term_italian,is_base,base_word_italian,translation_english,topics,gender,plurality,article_type,article_italian,added_particle_italian,preposition,notes,example_sentence_italian,example_sentence_english
gli alberghi,false,albergo,the hotels,"places,accommodation",masculine,plural,definite,gli,gli,n/a,,"Gli alberghi della costa sono pieni.","The hotels on the coast are full.")
degli alberghi,false,albergo,some hotels,"places,accommodation",masculine,plural,articulated_preposition,degli,degli,di,,"Ho visitato degli alberghi in città.","I visited some hotels in the city.")
dell'albergo,false,albergo,of the hotel,"places,accommodation",masculine,singular,articulated_preposition,dell',dell',di,,"La reception dell'albergo è aperta 24h.","The hotel's reception is open 24h.")
all'albergo,false,albergo,to the hotel,"places,accommodation",masculine,singular,articulated_preposition,all',all',a,,"Arrivo all'albergo domani.","I arrive at the hotel tomorrow.")
agli alberghi,false,albergo,to the hotels,"places,accommodation",masculine,plural,articulated_preposition,agli,agli,a,,"Consegno brochure agli alberghi locali.","I deliver brochures to the local hotels.")
dal albergo,false,albergo,from the hotel (use dall'),"places,accommodation",masculine,singular,articulated_preposition,dall',dall',da,,"Parto dall'albergo alle sei.","I leave the hotel at six.")
dai alberghi,false,albergo,from the hotels (use dagli), "places,accommodation",masculine,plural,articulated_preposition,dagli,dagli,da,,"Riceviamo feedback dai alberghi della zona.","We receive feedback from the area's hotels.")
nell'albergo,false,albergo,in the hotel,"places,accommodation",masculine,singular,articulated_preposition,nell',nell',in,,"C'è una piscina nell'albergo.","There is a pool in the hotel.")
negli alberghi,false,albergo,in the hotels,"places,accommodation",masculine,plural,articulated_preposition,negli,negli,in,,"Organizzo eventi negli alberghi.","I organize events in the hotels.")
sull'albergo,false,albergo,on the hotel,"places,accommodation",masculine,singular,articulated_preposition,sull',sull',su,,"C'è un'insegna sull'albergo.","There is a sign on the hotel.")
sugli alberghi,false,albergo,on the hotels,"places,accommodation",masculine,plural,articulated_preposition,sugli,sugli,su,,"Ho letto recensioni sugli alberghi.","I read reviews about the hotels.")
con l'albergo,false,albergo,with the hotel,"places,accommodation",masculine,singular,articulated_preposition,con l',con l',con,not contracted,,"Collaboriamo con l'albergo per la conferenza.","We collaborate with the hotel for the conference.")
con gli alberghi,false,albergo,with the hotels,"places,accommodation",masculine,plural,articulated_preposition,con gli,con gli,con,not contracted,,"Firmiamo contratti con gli alberghi della zona.","We sign contracts with the area's hotels.")
strada,true,strada,street, "places,transport",feminine,singular,none,n/a,n/a,n/a,base lemma,"La strada è lunga.","The street is long."
una strada,false,strada,a street,"places,transport",feminine,singular,indefinite,una,una,n/a,,"Cammino lungo una strada trafficata.","I walk along a busy street.")
la strada,false,strada,the street,"places,transport",feminine,singular,definite,la,la,n/a,,"La strada è chiusa.","The street is closed.")
strade,false,strada,streets,"places,transport",feminine,plural,none,n/a,n/a,n/a,plural form,"Le strade sono sporche dopo la pioggia.","The streets are dirty after the rain.")
le strade,false,strada,the streets,"places,transport",feminine,plural,definite,le,le,n/a,,"Le strade del centro sono pedonali.","The city center streets are pedestrian.")
delle strade,false,strada,some streets,"places,transport",feminine,plural,articulated_preposition,delle,delle,di,,"Ho esplorato delle strade secondarie.","I explored some side streets.")
della strada,false,strada,of the street,"places,transport",feminine,singular,articulated_preposition,della,della,di,,"La segnaletica della strada è chiara.","The street signs are clear.")
alla strada,false,strada,to the street (use 'in' often),"places,transport",feminine,singular,articulated_preposition,alla,alla,a,,"Vai alla strada principale.","Go to the main street.")
alle strade,false,strada,to the streets,"places,transport",feminine,plural,articulated_preposition,alle,alle,a,,"Portiamo i materiali alle strade laterali.","We bring materials to the side streets.")
dalla strada,false,strada,from the street,"places,transport",feminine,singular,articulated_preposition,dalla,dalla,da,,"Guardavo dalla strada.","I was watching from the street.")
dalle strade,false,strada,from the streets,"places,transport",feminine,plural,articulated_preposition,dalle,dalle,da,,"I rumori dalle strade disturbarono il riposo.","The noises from the streets disturbed the rest.")
nella strada,false,strada,in the street,"places,transport",feminine,singular,articulated_preposition,nella,nella,in,,"C'è una fontana nella strada.","There is a fountain in the street.")
nelle strade,false,strada,in the streets,"places,transport",feminine,plural,articulated_preposition,nelle,nelle,in,,"Si trovano negozi nelle strade laterali.","You find shops in the side streets.")
sulla strada,false,strada,on the street,"places,transport",feminine,singular,articulated_preposition,sulla,sulla,su,,"Ho lasciato la bici sulla strada.","I left the bike on the street.")
sulle strade,false,strada,on the streets,"places,transport",feminine,plural,articulated_preposition,sulle,sulle,su,,"Ci sono cantieri sulle strade.","There are construction sites on the streets.")
con la strada,false,strada,with the street (figurative),"places,transport",feminine,singular,articulated_preposition,con la,con la,con,not contracted,,"Pianifichiamo con la strada locale per la deviazione.","We plan with the local road for the detour.")
con le strade,false,strada,with the streets,"places,transport",feminine,plural,articulated_preposition,con le,con le,con,not contracted,,"Collaboriamo con le strade cittadine per gli eventi.","We collaborate with the city streets for events.")
negozio,true,negozio,shop/store,"commerce,places",masculine,singular,none,n/a,n/a,n/a,base lemma,"Vado al negozio per comprare pane.","I go to the shop to buy bread.")
un negozio,false,negozio,a shop,"commerce,places",masculine,singular,indefinite,un,un,n/a,,"Apro un negozio online.","I open an online shop.")
il negozio,false,negozio,the shop,"commerce,places",masculine,singular,definite,il,il,n/a,,"Il negozio chiude alle otto.","The shop closes at eight.")
negozi,false,negozio,shops,"commerce,places",masculine,plural,none,n/a,n/a,n/a,plural form,"I negozi sono affollati.","The shops are crowded.")
i negozi,false,negozio,the shops,"commerce,places",masculine,plural,definite,i,i,n/a,,"I negozi offrono sconti.","The shops offer discounts.")
dei negozi,false,negozio,some shops,"commerce,places",masculine,plural,articulated_preposition,dei,dei,di,,"Ho visitato dei negozi nuovi.","I visited some new shops.")
del negozio,false,negozio,of the shop,"commerce,places",masculine,singular,articulated_preposition,del,del,di,,"Il proprietario del negozio è gentile.","The shop owner is kind.")
al negozio,false,negozio,to the shop,"commerce,places",masculine,singular,articulated_preposition,al,al,a,,"Vado al negozio a comprare frutta.","I go to the shop to buy fruit.")
ai negozi,false,negozio,to the shops,"commerce,places",masculine,plural,articulated_preposition,ai,ai,a,,"Consegno volantini ai negozi locali.","I deliver flyers to the local shops.")
dal negozio,false,negozio,from the shop,"commerce,places",masculine,singular,articulated_preposition,dal,dal,da,,"Torno dal negozio con le borse.","I return from the shop with the bags.")
dai negozi,false,negozio,from the shops,"commerce,places",masculine,plural,articulated_preposition,dai,dai,da,,"Ho comprato prodotti dai negozi artigianali.","I bought products from the artisan shops.")
nel negozio,false,negozio,in the shop,"commerce,places",masculine,singular,articulated_preposition,nel,nel,in,,"C'è una promozione nel negozio.","There is a promotion in the shop.")
nei negozi,false,negozio,in the shops,"commerce,places",masculine,plural,articulated_preposition,nei,nei,in,,"Trovi regali nei negozi del centro.","You find gifts in the downtown shops.")
sul negozio,false,negozio,on the shop,"commerce,places",masculine,singular,articulated_preposition,sul,sul,su,,"C'è un'insegna sul negozio.","There is a sign on the shop.")
sui negozi,false,negozio,on the shops,"commerce,places",masculine,plural,articulated_preposition,sui,sui,su,,"Ho letto recensioni sui negozi online.","I read reviews about the online shops.")
col negozio,false,negozio,with the shop (figurative),"commerce,places",masculine,singular,articulated_preposition,col,col,con,common contraction,"Collaboriamo col negozio per la vendita.","We collaborate with the shop for the sale.")
coi negozi,false,negozio,with the shops,"commerce,places",masculine,plural,articulated_preposition,coi,coi,con,common contraction,"Distribuiamo volantini coi negozi del quartiere.","We distribute flyers with the neighborhood shops.")