term_italian,is_base,base_lemma_italian,base_lemma_english,part_of_speech,translation_english,topics,subtype,person_number,gender,plurality,mood,tense,is_comparative,is_superlative,is_compound,article_type,article_italian,added_particle_italian,preposition,notes,example_sentence_italian,example_sentence_english,english_audio_hash,english_duration_ms,italian_audio_hash,italian_duration_ms
buonasera,True,buonasera,good evening,noun,good evening,"greetings,politeness",,,masculine,singular,,,False,False,False,,,,,"invariable masculine noun; greeting formula; often written as two words ""buona sera""; commonly used standalone without article",Buonasera!,Good evening!,51a8875cbc2bb00c1c3e51d1eb74dbe5d45cbaaf0160eb50f375625c66651377,1320.0,0a3839646ce8dcded16e9509ca42100dad9b1a202a9616bc1bfb761fbd69032d,1584.0
un buonasera,False,buonasera,good evening,noun,a good evening,"greetings,politeness",,,masculine,singular,,,False,False,False,indefinite,un,un,,"used with article in phrases like ""Un buonasera a tutti!""; masculine invariable",Un buonasera a tutti!,A good evening to everyone!,2742a7294d15f64d2c19b71f13183e2e5781fc7e6dc666e5a0dd85ac0d328f54,1440.0,47386cf5542a96a63d84389a0dd92bc7657813a217c0c3d65a1d53aefc6927cd,1728.0
il buonasera,False,buonasera,good evening,noun,the good evening,"greetings,politeness",,,masculine,singular,,,False,False,False,definite,il,il,,rare with article; masculine invariable greeting,Il buonasera del presentatore è stato caloroso.,The good evening from the host was warm.,9278bebfa706fa114be48b852cad0e9950399bf082d516f60037514ea72dc644,1440.0,3ddecbf7494dc36b9f2f4da5666bbe5803542661f5879cbc0838e3893636d8d4,1728.0
buonasera,False,buonasera,good evening,noun,good evenings,"greetings,politeness",,,masculine,plural,,,False,False,False,,,,,invariable plural; identical to singular,Ho sentito molti buonasera.,I heard many good evenings.,d59bd8078c4c86ad5a13e46cd7d115dcf4df5480f9a2ab1cfe67dec11c197380,1464.0,0a3839646ce8dcded16e9509ca42100dad9b1a202a9616bc1bfb761fbd69032d,1584.0
i buonasera,False,buonasera,good evening,noun,the good evenings,"greetings,politeness",,,masculine,plural,,,False,False,False,definite,i,i,,invariable plural with article,I buonasera arrivavano da ogni parte.,The good evenings were coming from everywhere.,73cefa0c206e4f4fe86aba352822896d7956ba47effe1c30d6728117f8b2102b,1560.0,f0be83c107ca7732155038fbc1ff77e5c58e5cb21f39c0281bdf4f910ddf058f,1656.0
dei buonasera,False,buonasera,good evening,noun,some good evenings,"greetings,politeness",,,masculine,plural,,,False,False,False,indefinite,i,dei,di,partitive plural form,Si sentivano dei buonasera nel corridoio.,Some good evenings were heard in the hallway.,b1f23fdaa5b3c633f404dc115b1feda79696826accf6e042715f78ea04b4445b,1680.0,61966df654aa2cda10cb57f08d1167af48c3efb42363be7b3dd9e157a8126e43,1776.0
del buonasera,False,buonasera,good evening,noun,of the good evening,"greetings,politeness",,,masculine,singular,,,False,False,False,articulated_preposition,il,del,di,contraction of di + il,Il tono del buonasera era cordiale.,The tone of the good evening was friendly.,971e10513d19812d3fda3ebab7a874b68a3fa445a730b8fc5f67e7a51f4d1371,1560.0,a7f3a708b3f215e3453500a27ca2aab21b434f8f59784ffe071bb6381b7cd8ab,1800.0
al buonasera,False,buonasera,good evening,noun,to the good evening,"greetings,politeness",,,masculine,singular,,,False,False,False,articulated_preposition,il,al,a,contraction of a + il,Rispondemmo al buonasera con un sorriso.,We replied to the good evening with a smile.,8942cfd7af8b2025563c7d5c7e826285c5e2edf08547a12318a95a107a178504,1536.0,bd168118083e46d99cdee3bfc0ca9dd4cb8b4d4812644d083bd6b4fd9577506d,1728.0
ai buonasera,False,buonasera,good evening,noun,to the good evenings,"greetings,politeness",,,masculine,plural,,,False,False,False,articulated_preposition,i,ai,a,contraction of a + i,Ho risposto ai buonasera dei vicini.,I replied to the neighbors' good evenings.,42fe94b2145c548f0cdf505469a2666aa822d0c4f8b0284be5cebd7f79957b26,1656.0,e40f93516a074b5cfe4c0f7c546960354bb4d96fe7c532956ea3a374234d2de0,1728.0
dal buonasera,False,buonasera,good evening,noun,from the good evening,"greetings,politeness",,,masculine,singular,,,False,False,False,articulated_preposition,il,dal,da,contraction of da + il,Siamo stati accolti dal buonasera del portiere.,We were welcomed by the doorman's good evening.,3510dd5a3407569ecf2a11b4a568bceafc9232d245e270ac5b2c174d464cc42e,1608.0,cf59dbbd9c2f41bb93b5c1382c189fa490115c02925a9d9905785ff6306ada51,1824.0
dai buonasera,False,buonasera,good evening,noun,from the good evenings,"greetings,politeness",,,masculine,plural,,,False,False,False,articulated_preposition,i,dai,da,contraction of da + i,Eravamo distratti dai buonasera.,We were distracted by the good evenings.,9a8849fea33b87ca96632b4ad9823ed586ed601bdf26c5534bab0f6589ea88ab,1728.0,03ff7bd7b94397fc5b4ccc5b2960a957e85463cb6d8d47ee3e1fd62325e220bb,1824.0
nel buonasera,False,buonasera,good evening,noun,in the good evening,"greetings,politeness",,,masculine,singular,,,False,False,False,articulated_preposition,il,nel,in,contraction of in + il,C'è calore nel buonasera di Maria.,There is warmth in Maria's good evening.,e5e886f7705268b29d09968300899a10e9544d691921b2f4aa65db3e14e82e32,1536.0,76929f0bf0d13a24b7a0e1f0a29667416d0345f4d5cf9a99ea54d5dc1fbdbd86,1800.0
nei buonasera,False,buonasera,good evening,noun,in the good evenings,"greetings,politeness",,,masculine,plural,,,False,False,False,articulated_preposition,i,nei,in,contraction of in + i,Ci perdevamo nei buonasera ripetuti.,We got lost in the repeated good evenings.,20cbfecfd41ba3de047d40d2afd6a3ac4e34bd809c431e74169273285bd23f50,1680.0,eaa55b7f92d4532990780a2173e17eb4249c8f4c90488cdc90bdeb77ca6cc892,1800.0
sul buonasera,False,buonasera,good evening,noun,about the good evening,"greetings,politeness",,,masculine,singular,,,False,False,False,articulated_preposition,il,sul,su,contraction of su + il,Hanno scherzato sul buonasera iniziale.,They joked about the initial good evening.,512f496dadb8b7bb8ae979e554d830074fbcf98475add7d1739b2975e37b553d,1728.0,07ef15c3df7051b73b2e9a776bba5d53c80d58947b5b8a5bb7e00ee755cea67a,1872.0
sui buonasera,False,buonasera,good evening,noun,about the good evenings,"greetings,politeness",,,masculine,plural,,,False,False,False,articulated_preposition,i,sui,su,contraction of su + i,Ridevano sui buonasera troppo formali.,They laughed about the overly formal good evenings.,21049237c0b6adda891aabbd359bdca2de8d378633007d27dbc61913e35d653a,1848.0,a9b028f66286af391aa3f684294792dee098ed8ca3e79bcf0d4ce152f35834bc,1920.0
col buonasera,False,buonasera,good evening,noun,with the good evening,"greetings,politeness",,,masculine,singular,,,False,False,False,articulated_preposition,il,col,con,contraction of con + il,Ha esordito col buonasera di rito.,He started with the customary good evening.,1d273ab36a7e7c0492afb134337595bbbc1b987429d6404b603bf489530505ca,1584.0,e42e067f4f36109fbd9d3b9965d2164dc6f0fdbadd0dc38f7b76d0f2eeb4ab92,1800.0
coi buonasera,False,buonasera,good evening,noun,with the good evenings,"greetings,politeness",,,masculine,plural,,,False,False,False,articulated_preposition,i,coi,con,contraction of con + i,Ha esagerato coi buonasera cerimoniosi.,He overdid it with ceremonious good evenings.,f8439736856daff601303c6cfac028d5ce5ab4159628d400467b2717f8db5afa,1728.0,d464ea4070bdf5c456e2461d2198bc93ccf29cba188cfef4821dd5eebae6204b,1824.0
