term_italian,is_base,base_lemma_italian,base_lemma_english,part_of_speech,translation_english,topics,subtype,person_number,gender,plurality,mood,tense,is_comparative,is_superlative,is_compound,article_type,article_italian,added_particle_italian,preposition,notes,example_sentence_italian,example_sentence_english,english_audio_hash,english_duration_ms,italian_audio_hash,italian_duration_ms
Roma,True,roma,Rome,noun,Rome,"places,geography",,,feminine,singular,,,False,False,False,,,,,"proper noun, city name; normally used without article",Vado a Roma.,I'm going to Rome.,3b7268c66da037167c3644ce92fe53b51c88b91a1ee76632c34bce4d6db98505,1008.0,fa60f3df16e302c3e68221e6a8e65b4faf5d67352672be3f2e81030d98c53a9a,1224.0
una Roma,False,roma,Rome,noun,a Rome,"places,geography",indefinite,,feminine,singular,,,False,False,False,,una,una,,poetic or figurative use; indefinite article before proper noun,Conosco una Roma diversa.,I know a different Rome.,5bf60632f0f1441029725f3a19a7bffe0b685d7dbf9b4d52def8563cf6ee2532,1152.0,bb80af7d8e4a0b6dd2d5ff3ad570f7e85656f3ad0720debae08726026334a7d8,1416.0
la Roma,False,roma,Rome,noun,the Rome,"places,geography",definite,,feminine,singular,,,False,False,False,,la,la,,"used sometimes (e.g., for the football club) or in specific contexts; city usually without article",Conosco la Roma antica.,I know ancient Rome.,3f04e16abc56db7af37a0aa1f4cb4a01e6980d1fc0b4c10fbd2add2fe833e9ae,1176.0,dadfbdc1f0d88a0ebf90644c109a8504d2e7011bb3b975e971df4d9f6f5b196a,1368.0
Rome,False,roma,Rome,noun,Romes,"places,geography",,,feminine,plural,,,False,False,False,,,,,rare; proper noun usually not plural,Vedo diverse Rome nella storia.,I see different Romes in history.,41b4bf3dee3d0ea0b3553f02baff30ef33e71e25ee71494ea3ab7b2c5adcdac8,1128.0,3ca2104d6bacaae0385ea529f7f32c5e503b1618f366752f93d5aa8de5aea2d0,1152.0
le Rome,False,roma,Rome,noun,the Romes,"places,geography",definite,,feminine,plural,,,False,False,False,,le,le,,definite plural; rare,Le Rome antiche erano potenti.,The ancient Romes were powerful.,a29180657d16df9b26d43c4d6c127d7db810ad4558a6f66bc39d497ba339f3c5,1296.0,6efe610d1721a989cb6b6b09feeb9b0d1b61c9e15c5ff767c3bc1e3618889d75,1296.0
delle Rome,False,roma,Rome,noun,some Romes,"places,geography",indefinite,,feminine,plural,,,False,False,False,indefinite,le,delle,di,partitive plural form; very rare before proper noun,Parlo delle Rome del passato.,I talk about the Romes of the past.,cfe8afc1bf352fa7b214939358f59c0b86a1573b35e301af0c235c098cefeaa3,1440.0,4da9dddfe504642aece6308cff17df7a235cc43939854c8f51bb6aaa79f989b2,1512.0
della Roma,False,roma,Rome,noun,of Rome,"places,geography",,,feminine,singular,,,False,False,False,articulated_preposition,la,della,di,contraction of di + la; used to mean 'of Rome'; often 'di Roma' preferred,La storia della Roma antica è affascinante.,The history of ancient Rome is fascinating.,e8a1917994dbde3ce1579332df31f1b84c300cd26730d33b6e54d00ae9b95810,1200.0,ec7abb36c446330fdc396963f361a73feb9faecd5b58443b197a144042c710bb,1536.0
alla Roma,False,roma,Rome,noun,to the Rome,"places,geography",,,feminine,singular,,,False,False,False,articulated_preposition,la,alla,a,contraction of a + la; often 'a Roma' is used instead,Mi riferisco alla Roma di una volta.,I refer to the Rome of former times.,3020321b618c41b6227ac51e82ef4c356fe6b980f48897489f133247549834aa,1296.0,10fdf3554bf75e553591bb5e7e25cb58b5e45a8d82ed5a05bead3a9eca979aad,1440.0
dalla Roma,False,roma,Rome,noun,from Rome,"places,geography",,,feminine,singular,,,False,False,False,articulated_preposition,la,dalla,da,contraction of da + la; often 'da Roma' is used,Torno dalla Roma storica.,I return from historic Rome.,16dc0b6eb0724e7b6d93052ecc95fa6f8158c4d08ef3064bc6052b6a8db09071,1272.0,5ce399b1ed020d632aece264bf97078933ff7c9936ef15104ee8cd337837ddac,1536.0
nella Roma,False,roma,Rome,noun,in the Rome,"places,geography",,,feminine,singular,,,False,False,False,articulated_preposition,la,nella,in,contraction of in + la; often 'a/in Roma' without article,Cammino nella Roma antica.,I walk in ancient Rome.,8065628c975691ebfae603b538d9173ee9056236b08ed6ace606f9164248200b,1272.0,830a2173fbc0089d368f909512bed651d7b63f9f716b3f57d51f769936009802,1536.0
sulla Roma,False,roma,Rome,noun,about Rome,"places,geography",,,feminine,singular,,,False,False,False,articulated_preposition,la,sulla,su,contraction of su + la; often 'su Roma' less common,Leggo un articolo sulla Roma antica.,I read an article about ancient Rome.,43a47cb8927db7eca3867718e691c4317556709e457dcfa932a589cceeb105c4,1344.0,74d956df4578d3a58a88f71fd042707345c1af2dba726d8c627e2b78703a344b,1584.0
con la Roma,False,roma,Rome,noun,with Rome,"places,geography",,,feminine,singular,,,False,False,False,articulated_preposition,la,con la,con,no contraction with la; used e.g. with the football club or team name,Ho parlato con la Roma ieri.,I spoke with Roma yesterday.,53156ada66e2349deff8f23d6ff06f103484fb287909e02b1eef4d7a5e5dafe6,1248.0,db7981ab459302154997cf0984ca11c32cde9061bb2df5dc52e1457826d15fc7,1536.0
alle Rome,False,roma,Rome,noun,to the Romes,"places,geography",,,feminine,plural,,,False,False,False,articulated_preposition,le,alle,a,contraction of a + le; rare,Vado alle Rome menzionate nei libri.,I go to the Romes mentioned in the books.,6dfd3f84db8b2602f3ce6995cba155be3d6cf0d37827b2a61bddd6aebe7b4d7f,1416.0,860bfad4feb013cbdf23d4ce07d67f4f3e8dccf22d4d218811ae822727050b29,1440.0
dalle Rome,False,roma,Rome,noun,from the Romes,"places,geography",,,feminine,plural,,,False,False,False,articulated_preposition,le,dalle,da,contraction of da + le; rare,Proveniamo dalle Rome storiche.,We come from the historic Romes.,c04d0e177ca8cebc207d357e398d102b1e3cbb3c919e7b5ba3c0a0f531252c78,1464.0,90241f0d66779b724a72e5a7527ce4a962826fecdc4f5ad34e6db24467f5d47c,1536.0
nelle Rome,False,roma,Rome,noun,in the Romes,"places,geography",,,feminine,plural,,,False,False,False,articulated_preposition,le,nelle,in,contraction of in + le; rare,Ci sono problemi nelle Rome antiche.,There are problems in the ancient Romes.,24e5579d84fbc7be7716b8a3556699f70dc1ea13753a13fb5fdc090642aa7e8e,1392.0,aae7659bfb942dd3a508499a2e4598c820a43453a20ca7a5bf8732c67a2c9e66,1536.0
sulle Rome,False,roma,Rome,noun,about the Romes,"places,geography",,,feminine,plural,,,False,False,False,articulated_preposition,le,sulle,su,contraction of su + le; rare,Ho informazioni sulle Rome antiche.,I have information about the ancient Romes.,e05e6e32087e1a456ab5e7753cdfb20db42efb8b56fc45e1573181279ec688d0,1560.0,1a9b0e43cdf3039ede966c68a49ad8ccc7941671c2cab917189b27e1a41d9acc,1584.0
con le Rome,False,roma,Rome,noun,with the Romes,"places,geography",,,feminine,plural,,,False,False,False,articulated_preposition,le,con le,con,no contraction with le; rare,Collaboriamo con le Rome partner.,We collaborate with the partner Romes.,8388f7fe7a870e1ee7330d0f9cf0665c317a513c3103fd65979a391e75b8661d,1440.0,6d41db0aba7c7ef563f4f5c6154eb5282068147d797cb93df704530cae593c74,1512.0
