term_italian,is_base,base_lemma_italian,base_lemma_english,part_of_speech,translation_english,topics,subtype,person_number,gender,plurality,mood,tense,is_comparative,is_superlative,is_compound,article_type,article_italian,added_particle_italian,preposition,notes,example_sentence_italian,example_sentence_english,italian_audio_hash,english_audio_hash,english_duration_ms,italian_duration_ms
lei,True,lei,she/you (formal),pron,she,"core,people",personal,3s,feminine,singular,,,False,False,False,,,,,subject pronoun; feminine; lowercase for she,Oggi lei canta bene.,Today she sings well.,14e444b16e2ffebde372832e37a4c7523d80b05ecf6adf78d908aa8b43a53491,19423cabdff95c983cdd9123db12a368a3bedc2b5fc2565dd2f732411aaf3149,984.0,1104.0
Lei,False,lei,she/you (formal),pron,you (formal),"core,people",personal,3s,,singular,,,False,False,False,,,,,formal address; takes third person singular verb; usually capitalized in writing,Lei è il direttore?,Are you (formal) the director?,203ce7818455035fa6a50337fa8d7a80fafccbcbc641066f26bd6349e36ebd35,e15605941d31b999167adb87db903384d348ae445866ee40d70f63723e3b5cbf,1536.0,1104.0
lei,False,lei,she/you (formal),pron,her,"core,people",direct_object,3s,feminine,singular,,,False,False,False,,,,,disjunctive object pronoun; used for emphasis,Vedo lei ogni giorno.,I see her every day.,14e444b16e2ffebde372832e37a4c7523d80b05ecf6adf78d908aa8b43a53491,ed8998d005b4f831dc27bd22038536f8a8800b6a2df717385221d9e474ca8089,912.0,1104.0
a lei,False,lei,she/you (formal),pron,to her,"core,people",indirect_object,3s,feminine,singular,,,False,False,False,,,,,disjunctive indirect object; often replaces clitic le,Parlo a lei ora.,I am speaking to her now.,31f17df440ce14d290168ac9ff020c21f09d740839a4e6c4231e7310007358e0,ba586bf08cff984f972f69e6411c1ab0c63a55c0c20f0d1c5a0ead07ec658cb8,1080.0,1176.0
a Lei,False,lei,she/you (formal),pron,to you (formal),"core,people",indirect_object,3s,,singular,,,False,False,False,,,,,formal indirect object; often replaces clitic Le,Scrivo a Lei domani.,I will write to you (formal) tomorrow.,b9c3faf7955be96a27e3ccad22ec9044f24ad1006855d157637e3199c95a71ce,4387731c7d8fdcbba4a7dd8c622849a0f8b7edbbd63b2211450494ada9904f5b,1704.0,1176.0
