term_italian,is_base,base_lemma_italian,base_lemma_english,part_of_speech,translation_english,topics,subtype,person_number,gender,plurality,mood,tense,is_comparative,is_superlative,is_compound,article_type,article_italian,added_particle_italian,preposition,notes,example_sentence_italian,example_sentence_english,italian_audio_hash,english_audio_hash,english_duration_ms,italian_duration_ms,pronunciation
arrestare,True,arrestare,to arrest,verb,to arrest,"law,crime",,,,,non-finite,infinitive,False,False,False,,,,,regular -are verb,La polizia deve arrestare il sospetto.,The police have to arrest the suspect.,c02ce968da7ac156b0f018b7873473256083bcd70e8291c6734785e4aa88a1ed,f997739d2739b70ec83461631400ef73c2dcb80f1dda05fb2f1cd5abbef58096,1368.0,1584.0,ahr-reh-STAH-reh
arrestando,False,arrestare,to arrest,verb,arresting,"law,crime",,,,,gerund,,False,False,False,,,,,gerund form,Lo stanno arrestando.,They are arresting him.,520eaacff4cff49451e3d1e63e876c1844134874669cd5fba3138a87fac3cc49,23c41d36b3e827e301ae2c3256df9a950765145d83e9b7bbdd505b3f5998fdeb,1248.0,1704.0,ahr-reh-STAHN-doh
arrestato,False,arrestare,to arrest,verb,arrested,"law,crime",,,masculine,singular,participle,past,False,False,False,,,,,past participle masculine singular,L'hanno arrestato.,They arrested him.,0bc50a712f19783e82243afd73db62da91cfef0ea4108f86663f2612bdae2984,f74ffcb69aac1e62778f66c8ab5cf5db3e0f7769a5d20611e2067245cce36829,1224.0,1656.0,ahr-reh-STAH-toh
arrestata,False,arrestare,to arrest,verb,arrested,"law,crime",,,feminine,singular,participle,past,False,False,False,,,,,past participle feminine singular,L'hanno arrestata.,They arrested her.,d58ab05e742114330223c0f48ccb138d5c7011194504408a6c7f40e61c85089d,f74ffcb69aac1e62778f66c8ab5cf5db3e0f7769a5d20611e2067245cce36829,1224.0,1632.0,ahr-reh-STAH-tah
arrestati,False,arrestare,to arrest,verb,arrested,"law,crime",,,masculine,plural,participle,past,False,False,False,,,,,past participle masculine plural,Li hanno arrestati.,They arrested them.,38de02d8c8da0d01ddcbfc45d14f5b43ea8b0c9ea32527d04dbd4a00324a806e,f74ffcb69aac1e62778f66c8ab5cf5db3e0f7769a5d20611e2067245cce36829,1224.0,1632.0,ahr-reh-STAH-tee
arrestate,False,arrestare,to arrest,verb,arrested,"law,crime",,,feminine,plural,participle,past,False,False,False,,,,,past participle feminine plural,Le hanno arrestate.,They arrested them.,7acdb4962d2107381f97d2844dc568ecbddedc5202e2c8483560e7282c2d5e2f,f74ffcb69aac1e62778f66c8ab5cf5db3e0f7769a5d20611e2067245cce36829,1224.0,1608.0,ahr-reh-STAH-teh
arresto,False,arrestare,to arrest,verb,I arrest,"law,crime",,1s,,singular,indicative,present,False,False,False,,,,,,Io arresto il ladro.,I arrest the thief.,57a97a699eadd2681a673e139fd101538da3842899f2950ea354c29b29b790fb,7b21124b0da8f9b0bad7c75871f6033ab674c0d12e695c2965e6e6ad5aa486be,1320.0,1488.0,ahr-REH-stoh
arresti,False,arrestare,to arrest,verb,you arrest,"law,crime",,2s,,singular,indicative,present,False,False,False,,,,,,Tu arresti i colpevoli?,Do you arrest the culprits?,3b7de7e51fc049c5ef41f0cd3de935097909a9ef284a28f40a3ca1577c6ba734,92176743234dd347b7f1e9b60795237486d966f6f76d7bfeb391be6e46ed759f,1392.0,1464.0,ahr-REH-stee
arresta,False,arrestare,to arrest,verb,he arrests/she arrests/you (formal) arrest,"law,crime",,3s,,singular,indicative,present,False,False,False,,,,,also used as formal Lei,Lui arresta il ladro.,He arrests the thief.,129a3f3f63954ebe712846e1b55a716833386f6b2e003fdba560a7d83a2c4eb2,d339bda576830cdb1387ad5994faa263b239cf1e4e3d1bcb6577811e3f48cfa5,5040.0,1440.0,ahr-REH-stah
arrestiamo,False,arrestare,to arrest,verb,we arrest,"law,crime",,1p,,plural,indicative,present,False,False,False,,,,,,Noi arrestiamo i sospetti.,We arrest the suspects.,fa0b7129947d00d9ffd50fdca4934f9c384c82407e6a7b732a90df1a80b597cb,d91f96f6a51f16629d1053c024272e2d44b2d4db60221056926f09d7efdfbe1b,1392.0,1656.0,ahr-reh-STEEAH-moh
arrestate,False,arrestare,to arrest,verb,you (plural) arrest,"law,crime",,2p,,plural,indicative,present,False,False,False,,,,,,Voi arrestate spesso di notte.,You (plural) arrest often at night.,7acdb4962d2107381f97d2844dc568ecbddedc5202e2c8483560e7282c2d5e2f,e157b0d82282836391dafae4af88e6d0b1042f6b6796f11358d20633c209879e,2472.0,1608.0,ahr-reh-STAH-teh
arrestano,False,arrestare,to arrest,verb,they arrest,"law,crime",,3p,,plural,indicative,present,False,False,False,,,,,,Loro arrestano i responsabili.,They arrest those responsible.,d363b6081df4463cb4f8be93cdad18d5c1f69850c5c02aeb879e51619d9aebc9,e6f8e91810e542eb71231997eeec926331208d6e3bcb385e2804af8b913ed92b,1416.0,1584.0,ahr-reh-STAH-noh
arrestavo,False,arrestare,to arrest,verb,I was arresting,"law,crime",,1s,,singular,indicative,imperfect,False,False,False,,,,,,Io arrestavo spesso i truffatori.,I was arresting fraudsters often.,0afc5ddbf9ca19505faae193a9f67f09a8d97015ffa91e9f021c843171cd1db9,3b555e48df104c6e361d313e3ad6b39654cccaaf148676b73490b9d19ef06caf,1560.0,1632.0,ahr-reh-STAH-voh
arrestavi,False,arrestare,to arrest,verb,you were arresting,"law,crime",,2s,,singular,indicative,imperfect,False,False,False,,,,,,Tu arrestavi molti ladri.,You were arresting many thieves.,3683e62b4cef3a106ccff8a2c8fb669d72b0bf765fd096f7196869706bea9025,e3471d64fea4acb217e6f1d8c1767013e480b043c0125e3e752665f03268ef3a,1584.0,1608.0,ahr-reh-STAH-vee
arrestava,False,arrestare,to arrest,verb,he was arresting/she was arresting/you (formal) were arresting,"law,crime",,3s,,singular,indicative,imperfect,False,False,False,,,,,also used as formal Lei,Lui arrestava ogni settimana.,He was arresting every week.,dcc8a8fa672907e050e5e6c00f3429fb5b3641e31fca67b518c703c764c0f1b6,1bd16a315c0ff4ef14921232f388f723cdf64c9de98498276391c49eb74978f4,5592.0,1608.0,ahr-reh-STAH-vah
arrestavamo,False,arrestare,to arrest,verb,we were arresting,"law,crime",,1p,,plural,indicative,imperfect,False,False,False,,,,,,Noi arrestavamo poche persone.,We were arresting few people.,637687262b3922cc6d96b73e83d66dfc091d58de326fc70788a9413029677add,d98dd3ab809bece9a07ec816811800886c31da6b7c1bdd404ac80935774dbf78,1584.0,1752.0,ahr-reh-stah-VAH-moh
arrestavate,False,arrestare,to arrest,verb,you (plural) were arresting,"law,crime",,2p,,plural,indicative,imperfect,False,False,False,,,,,,Voi arrestavate senza sosta.,You (plural) were arresting without a break.,456793de9dda70629a1a3f66c818392def77e737e56907d3c23386b2718d1b0e,d0c61e2f96520c09dee8cdef4af669e554567e05f827e55b6768c002883ce1c3,2688.0,1752.0,ahr-reh-stah-VAH-teh
arrestavano,False,arrestare,to arrest,verb,they were arresting,"law,crime",,3p,,plural,indicative,imperfect,False,False,False,,,,,,Loro arrestavano i manifestanti.,They were arresting the protesters.,feb54fe83f1914b1d5fd64f8f67de25de71ca03229cb14158083047a6764cff9,000958cb6f43c5a60fb2fcd3c2e3717734db092bf1e4bf59a51a610f959e790c,1584.0,1752.0,ahr-reh-stah-VAH-noh
ho arrestato,False,arrestare,to arrest,verb,I have arrested,"law,crime",,1s,,singular,indicative,passato prossimo,False,False,True,,,,,used with auxiliary avere; past participle arrestato,Ho arrestato il ladro.,I have arrested the thief.,f8874ead863bd51af2973b5daafd50e44d00ef3d685c523b306155c74bfe7ad8,04872ffc8ff74708ed8148eb3e88eb5b0e90b1eb7d318cac0d57390b6a7b3867,1488.0,1800.0,OH ahr-reh-STAH-toh
hai arrestato,False,arrestare,to arrest,verb,you have arrested,"law,crime",,2s,,singular,indicative,passato prossimo,False,False,True,,,,,used with auxiliary avere; past participle arrestato,Hai arrestato il sospetto?,Have you arrested the suspect?,0306a93d4f7f3ed609ea3fbf4fe3329f8c5f75e3cf5b3664566e6423ab772e2a,de9f4c75c62fc5a756d6833a25b742765525b48a66d2b9f861bba8fb427396f2,1536.0,1848.0,AHEE ahr-reh-STAH-toh
ha arrestato,False,arrestare,to arrest,verb,he has arrested/she has arrested/you (formal) have arrested,"law,crime",,3s,,singular,indicative,passato prossimo,False,False,True,,,,,used with auxiliary avere; past participle arrestato; also used as formal Lei,Ha arrestato il sospetto.,He has arrested the suspect.,e416e8c1f508865c8ef3b085425b098d94e61edf2f7a6142b84c7c9fced22e44,320a1678968c9727cb19e476e5639220881d98fb83b733283937d56e3d0a7c1d,5544.0,1776.0,AH ahr-reh-STAH-toh
abbiamo arrestato,False,arrestare,to arrest,verb,we have arrested,"law,crime",,1p,,plural,indicative,passato prossimo,False,False,True,,,,,used with auxiliary avere; past participle arrestato,Abbiamo arrestato i responsabili.,We have arrested those responsible.,0859adca0868e4dc8f919e19274cd449afcd12cd4a7608c02f5a6294704aab3c,a89c16740f4c253b721201bdd3ee975a36e977028ba567eb2e8dbebf26b3be72,1536.0,2136.0,ahb-BEEAH-moh ahr-reh-STAH-toh
avete arrestato,False,arrestare,to arrest,verb,you (plural) have arrested,"law,crime",,2p,,plural,indicative,passato prossimo,False,False,True,,,,,used with auxiliary avere; past participle arrestato,Avete arrestato tutti.,You (plural) have arrested everyone.,a0d42af29567807c01fc1094cfa5dc48c8a80f9116294389311598151ea32582,a9a581736655528936beaaf4d4fddcda84cc2b44a032767b5cd3aa5f08ea91fc,2616.0,2040.0,ah-VEH-teh ahr-reh-STAH-toh
hanno arrestato,False,arrestare,to arrest,verb,they have arrested,"law,crime",,3p,,plural,indicative,passato prossimo,False,False,True,,,,,used with auxiliary avere; past participle arrestato,Hanno arrestato tre persone.,They have arrested three people.,05896ddc2c08bbb12a578df2b6ab2f43c793636455bd806dd675f9c03f7bb7f6,88146cd9aca018714cf20ba3c41e548d49a23115eaca4ce00cd15ecde65508be,1536.0,1944.0,AHN-noh ahr-reh-STAH-toh
