term_italian,is_base,base_lemma_italian,base_lemma_english,part_of_speech,translation_english,topics,subtype,person_number,gender,plurality,mood,tense,is_comparative,is_superlative,is_compound,article_type,article_italian,added_particle_italian,preposition,notes,example_sentence_italian,example_sentence_english,italian_audio_hash,english_audio_hash,english_duration_ms,italian_duration_ms
dare,True,dare,to give,verb,to give,"core,verb",,,,,non-finite,infinitive,False,False,False,,,,,irregular present: do/dai/dà/diamo/date/danno; past participle 'dato',Voglio dare una mano.,I want to give a hand.,7bdfb196417792ed6df85184822db07b7e542c03ac2da1b10a42388238da4471,440a2cd4faea1a0cc7413100477de4be5b62cc8a9c6e0f96064124b8c259af68,1080.0,1224.0
dando,False,dare,to give,verb,giving,"core,verb",,,,,gerund,,False,False,False,,,,,gerund form,Sto dando una mano.,I am giving a hand.,7d9a660647a6bfa2ea8d537e1b255cb1f4dac7409448d6155257a9132e627d47,1f0171ae165c8e704f2a23861dec74f1dc1782922a350899c53f2fc45515c496,1056.0,1344.0
dato,False,dare,to give,verb,given,"core,verb",,,masculine,singular,participle,past,False,False,False,,,,,past participle (masculine singular),L'ho dato ieri.,I gave it yesterday.,956c27dc4db81bf345bb8ea6bf73cc41a5d28484e8600d02f83999b1ffc22409,0ddb29510405d4e53d9dfff95bdedc7c721f7a03b13119673c7b04ccf3fbed3c,1032.0,1272.0
data,False,dare,to give,verb,given,"core,verb",,,feminine,singular,participle,past,False,False,False,,,,,past participle (feminine singular),L'ho data al capo.,I gave it to the boss.,326c87b15d5ad0eab0412d7fc4d40af0d012800dfdb1add3f61f70a1b46ee9e5,0ddb29510405d4e53d9dfff95bdedc7c721f7a03b13119673c7b04ccf3fbed3c,1032.0,1272.0
dati,False,dare,to give,verb,given,"core,verb",,,masculine,plural,participle,past,False,False,False,,,,,past participle (masculine plural),Li ho dati a Marco.,I gave them to Marco.,ea675e4f6028fb17459957394e9313b15c8fd1c77c819a24221f989a7c6ce175,0ddb29510405d4e53d9dfff95bdedc7c721f7a03b13119673c7b04ccf3fbed3c,1032.0,1272.0
date,False,dare,to give,verb,given,"core,verb",,,feminine,plural,participle,past,False,False,False,,,,,past participle (feminine plural),Le ho date a Maria.,I gave them to Maria.,5e7a7f1c18d36d94d35aac0b85ef039a3e60ce9f43343f38b657a7e9f423f5f0,0ddb29510405d4e53d9dfff95bdedc7c721f7a03b13119673c7b04ccf3fbed3c,1032.0,1272.0
do,False,dare,to give,verb,I give,"core,verb",,1s,,singular,indicative,present,False,False,False,,,,,,Io do una mano.,I give a hand.,0dd2db437c23b13088169e00eb5bdcd031801289a0d42154ff663e53131310ac,5b34068e7aee0a4600319c902895b496b75d2a413e27c80c4ffdefdd5574ea3b,1080.0,960.0
dai,False,dare,to give,verb,you give,"core,verb",,2s,,singular,indicative,present,False,False,False,,,,,,Tu dai ottimi consigli.,You give great advice.,610681d5f0f26c19795939cca5825064ed8429155e7740ac7855e5b3978bc2e3,f0ee151faf1b69afdd2190dab0a1fb10fcd7d8745eb16626089e2c3888a32b79,1104.0,1152.0
dà,False,dare,to give,verb,he gives/she gives/you (formal) give,"core,verb",,3s,,singular,indicative,present,False,False,False,,,,,also used as formal 'Lei',Lei dà sempre buoni consigli.,She always gives good advice.,1334322b6fa87e467ade9f978f94f119863de85f2d6286d1a26af18191fb86e0,2dd641cf5b00cdf0d564a4ba0805cc62b8954e9d1a21526c2be9a599383b30da,4440.0,960.0
diamo,False,dare,to give,verb,we give,"core,verb",,1p,,plural,indicative,present,False,False,False,,,,,,Noi diamo una festa.,We are throwing a party.,b3da250413fadbdbfd478efa810c192d2943cdbf0420aee6cce21d593249f029,514c6ccb1d400becaa49f8b87d804e729783689091cbe0215485a49c26f39266,1104.0,1272.0
date,False,dare,to give,verb,you (plural) give,"core,verb",,2p,,plural,indicative,present,False,False,False,,,,,,Voi date troppa importanza ai dettagli.,You place too much importance on details.,5e7a7f1c18d36d94d35aac0b85ef039a3e60ce9f43343f38b657a7e9f423f5f0,cb5b53d663c83cd82cd3ecbf48cf21484a77bbbf1a0a71b684a82d0f2c7e43f6,2232.0,1272.0
danno,False,dare,to give,verb,they give,"core,verb",,3p,,plural,indicative,present,False,False,False,,,,,,Loro danno il benvenuto a tutti.,They welcome everyone.,1f0dba2a4785055fad9ac4af801cf5b40c6b38eb92d536449a69448fa773f94d,3d2920138a369ed1b45ff5f769c8b54ac99ff467f9b49717bb00de1dec01a202,1128.0,1296.0
davo,False,dare,to give,verb,I was giving,"core,verb",,1s,,singular,indicative,imperfect,False,False,False,,,,,,Io davo una mano ogni giorno.,I was giving a hand every day.,e1ab8a6337216aa3937a860505e966af59a8a7e164a02c1cd0fbb28cc64aa34e,c2d9190a40f2802c7dd22cf85bca81f3a87e2a88bbf51e1f28ca48f96f23bec5,1344.0,1248.0
davi,False,dare,to give,verb,you were giving,"core,verb",,2s,,singular,indicative,imperfect,False,False,False,,,,,,Tu davi troppa fiducia.,You were giving too much trust.,68e631b81d7c325e357fc5fdfb8910635a5faa00e9310f633ad397b77643cf85,a3717b1d53314c57d46068d1acc07ef6bda15707dec380922cc6054a872cecd0,1368.0,1224.0
dava,False,dare,to give,verb,he was giving/she was giving/you (formal) were giving,"core,verb",,3s,,singular,indicative,imperfect,False,False,False,,,,,also used as formal 'Lei',Lei dava sempre buoni consigli.,She was always giving good advice.,ffc842ed5255e754173c85c090e679eeeebf7b226438017f1463d4a53af91ed7,60ac864a980b277ce38b5c3e0b19eaf4ee1ff139afd6495e9d38f022bef4e5f4,5040.0,1248.0
davamo,False,dare,to give,verb,we were giving,"core,verb",,1p,,plural,indicative,imperfect,False,False,False,,,,,,Noi davamo il massimo.,We were giving our best.,1a4d334f637c5e3834be3a5c685a28e7ac7ed5decc7f1e9291772d21a3ebb6dc,ec0450f8cf5f1f513b2d175dd90c72b58cbec72ac95b7d1532fdb57b1a6d80b5,1368.0,1392.0
davate,False,dare,to give,verb,you (plural) were giving,"core,verb",,2p,,plural,indicative,imperfect,False,False,False,,,,,,Voi davate tutto.,You were giving everything.,ed8464300cb5d80f21c6c04220f375880cb706d6f592059520f7e60c0d7f8951,a0e1173ec38548e3b0daf820f6f3440f2e66815e268da34d2d0cc3dab92ff368,2472.0,1392.0
davano,False,dare,to give,verb,they were giving,"core,verb",,3p,,plural,indicative,imperfect,False,False,False,,,,,,Loro davano soldi in beneficenza.,They were giving money to charity.,9c5252784a753c8279a480239457e273acd2a49d9403764273c3b09bf7d15345,601bee007e3495c60d38234a9513be95905c229c59759a26d9de2cf6cceb3c2b,1368.0,1392.0
ho dato,False,dare,to give,verb,I have given,"core,verb",,1s,,singular,indicative,passato prossimo,False,False,True,,,,,used with auxiliary avere; past participle 'dato',Ho dato la chiave a Luca.,I have given the key to Luca.,5218716e9d6e3d9c79a75bec82c35223280d6a98cefe5102a637fdc2a1bf82be,a7cab3a0571d99f9908bcb2191d71bd394b22d4efa851bcb301defdcc7016633,1296.0,1320.0
hai dato,False,dare,to give,verb,you have given,"core,verb",,2s,,singular,indicative,passato prossimo,False,False,True,,,,,used with auxiliary avere; past participle 'dato',Hai dato tutto oggi.,You have given everything today.,be114d8ee50eb39b14606d44e473826f7c40d4dfe14bdf39002788a8bebeea59,5a120d83cee581282444c6578c48f5f6c5fea159674b900a5957b78d4f654633,1344.0,1392.0
ha dato,False,dare,to give,verb,he has given/she has given/you (formal) have given,"core,verb",,3s,,singular,indicative,passato prossimo,False,False,True,,,,,used with auxiliary avere; also used as formal 'Lei',Ha dato una risposta chiara.,He has given a clear answer.,8ef6938efa767d0b5e9b1106037dca57dc15ba1c7b654bb0b8eecd34d9acdfad,29dde84d1ddf71bb16e7553168ef621bdcbe9d0dff51aa028df4a7d32d853379,4992.0,1320.0
abbiamo dato,False,dare,to give,verb,we have given,"core,verb",,1p,,plural,indicative,passato prossimo,False,False,True,,,,,used with auxiliary avere; past participle 'dato',Abbiamo dato il nostro meglio.,We have given our best.,888ff52a90cba40b9418d184d89713380772d6950a2ce6dc65a19737dd352001,25b86688f1cb8cdf06e70dfad427a8358f2db5e9705f838d0e43fa9f042039cd,1344.0,1728.0
avete dato,False,dare,to give,verb,you (plural) have given,"core,verb",,2p,,plural,indicative,passato prossimo,False,False,True,,,,,used with auxiliary avere; past participle 'dato',Avete dato i documenti?,Have you given the documents?,89d5fc4d4a1235953403f734fc1798240ea0a6e5323acd67c412d898bfb99438,76215109f511826493202c3d52b9381962a86b0543c41071ebbc084b423aca74,2448.0,1632.0
hanno dato,False,dare,to give,verb,they have given,"core,verb",,3p,,plural,indicative,passato prossimo,False,False,True,,,,,used with auxiliary avere; past participle 'dato',Hanno dato il via al progetto.,They have started the project.,5435cdfd4c225f43b94514cf0cc69f302b79683dbe4c532f81a70446ff822ccc,c2acd4129bfd31b8302c6c973b0dc02f53dc5a57e44331e86a8b8bd3df905dae,1344.0,1536.0
