term_italian,is_base,base_lemma_italian,base_lemma_english,part_of_speech,translation_english,topics,subtype,person_number,gender,plurality,mood,tense,is_comparative,is_superlative,is_compound,article_type,article_italian,added_particle_italian,preposition,notes,example_sentence_italian,example_sentence_english,italian_audio_hash,english_audio_hash
fare,True,fare,to do/make,verb,to do/make,"core,verb",,,,,non-finite,infinitive,False,False,False,,,,,highly irregular verb; auxiliary avere; past participle 'fatto',Voglio fare una pausa.,I want to take a break.,a082ac470cce6d3a5aa5e0c65d2ecfe42d18d2177a2a698017f8d083416a0776,0ddbe277f768e95b2848eebb8d96eb06bafe2145ed1f1ea443ca1b38bf3a767e
facendo,False,fare,to do/make,verb,doing/making,"core,verb",,,,,gerund,,False,False,False,,,,,gerund form,Sto facendo i compiti.,I am doing my homework.,48d4bf2c37ab635bb077a4dae749a5f67249c86ca886e54a9f4c61af6701c39a,8aa07483accf0590075b917fd6dad126c26b0bde30e3747e2592296004c4dedf
fatto,False,fare,to do/make,verb,done/made,"core,verb",,,masculine,singular,participle,past,False,False,False,,,,,past participle; irregular root; masculine singular,L'ho fatto.,I did it.,345d12ad55b7447247c9fa99a4f6cab01e27d116fbae6500e60662b0874d56b2,378b86d74c5823a2433d3333de2134ff46291638f7ce1fe5adaa79df79232c4e
fatta,False,fare,to do/make,verb,done/made,"core,verb",,,feminine,singular,participle,past,False,False,False,,,,,past participle; irregular root; feminine singular,L'ho fatta.,I did it.,49494dd32ac10983ead777a2fde6dd02141868a52e2f66532dda9e4bfa59067c,378b86d74c5823a2433d3333de2134ff46291638f7ce1fe5adaa79df79232c4e
fatti,False,fare,to do/make,verb,done/made,"core,verb",,,masculine,plural,participle,past,False,False,False,,,,,past participle; irregular root; masculine plural,Li ho fatti.,I did them.,87aab51aca280a7cb3df98c2940ec465ef9e71a04f45f6574f1a90ce3e372dc7,378b86d74c5823a2433d3333de2134ff46291638f7ce1fe5adaa79df79232c4e
fatte,False,fare,to do/make,verb,done/made,"core,verb",,,feminine,plural,participle,past,False,False,False,,,,,past participle; irregular root; feminine plural,Le ho fatte.,I did them.,5e65cf18f43496abe0022d8fb5faf624536fd1fb0affb26000cd77d20aeeb075,378b86d74c5823a2433d3333de2134ff46291638f7ce1fe5adaa79df79232c4e
faccio,False,fare,to do/make,verb,I do/make,"core,verb",,1s,,singular,indicative,present,False,False,False,,,,,irregular present form,Io faccio colazione presto.,I have breakfast early.,18a697dd84d392503c7253c1fd9c9d47da095431c9bee750b4bb23b2e935cf8c,78c9af8299497a5aa4022f6e94878104464a4191ff69584ddd3ceb8ef50b635d
fai,False,fare,to do/make,verb,you do/make,"core,verb",,2s,,singular,indicative,present,False,False,False,,,,,,Tu fai domande interessanti.,You ask interesting questions.,91d046f3f11044c2a89581fa52b0a87ed39446a02b82ed51c1fe934eba92b28e,70be84a3da0e236700fe4e331f2694e50ec447b57d803fba7cbe27fa1fd0e9d0
fa,False,fare,to do/make,verb,he does/makes/she does/makes/you (formal) do/make,"core,verb",,3s,,singular,indicative,present,False,False,False,,,,,also used as formal 'Lei',Lui fa sport ogni giorno.,He exercises every day.,b28fac3a86dbe44dbd9f6b2abd70035b2dfa1599eb8a00cb87ccfdaa562a81b8,d650aa392eb4b180db6c5a9fdb99eff34837ac439c16185250489422bdf843a9
facciamo,False,fare,to do/make,verb,we do/make,"core,verb",,1p,,plural,indicative,present,False,False,False,,,,,,Facciamo una passeggiata?,Shall we take a walk?,a2e29e27e1d528883b6344c34dfaeed34642698c60adab1c64df25454a68c6e5,1500334fb4e095edc93bc5ebef4bb3fe340d583950f2e354e2ada5ec35c4f2da
fate,False,fare,to do/make,verb,you (plural) do/make,"core,verb",,2p,,plural,indicative,present,False,False,False,,,,,,Voi fate una lista.,You make a list.,0483a4a27e74764d7b1c20d8cf7c587a8e07d333ff35bd0fcb3f751df3d492b2,0fa37f74a95f478da42a98d191cf0ea065f6ae90f298ab687cd209bf6c90f55c
fanno,False,fare,to do/make,verb,they do/make,"core,verb",,3p,,plural,indicative,present,False,False,False,,,,,,Loro fanno troppo rumore.,They make too much noise.,e9541e08b38f016fd02d7f1c0f5a080059192847b4c8636f593e28c3a000f2d1,069fcc858e183a0dcae73dabd7b41ad27d42f9ac3d438955de27a04d46438ea7
facevo,False,fare,to do/make,verb,I was doing/making,"core,verb",,1s,,singular,indicative,imperfect,False,False,False,,,,,,Io facevo jogging al mattino.,I used to jog in the morning.,226338020402d99d72a67d7c43bc7a928c9af0aa065c2c3a8c54b09ecd31e177,fc48a0601e2076c37638b0b32caf7880dfbc1c4c218ed0c7262c8a09ed60431b
facevi,False,fare,to do/make,verb,you were doing/making,"core,verb",,2s,,singular,indicative,imperfect,False,False,False,,,,,,Tu facevi molti errori.,You were making many mistakes.,84a88535b35b99428fd784bce8d4350c645359ec8867b7d1b0a3a47aa1d32e05,1bb843fb958e615c3798ece0a30d475ef7507a3fb7472360472acb5ec4fb6060
faceva,False,fare,to do/make,verb,he was doing/making/she was doing/making/you (formal) were doing/making,"core,verb",,3s,,singular,indicative,imperfect,False,False,False,,,,,also used as formal 'Lei',Lei faceva tardi.,She was running late.,47a608339a2fee5905218d7397f05ee86a7a30d836541418543c0e11a1efa76d,97dc1d1a4a30442041b39986d7645bcb33ac5150a0c22275f07bed34028e46cd
facevamo,False,fare,to do/make,verb,we were doing/making,"core,verb",,1p,,plural,indicative,imperfect,False,False,False,,,,,,Noi facevamo la spesa il sabato.,We used to do the shopping on Saturdays.,a41d951961b8ffdf3e31fbadb0d956e7fd1f83e34b3256ac6766d9121366e34c,7e130306ca8ca92d1d0c426d5ff6cef88d1d9d334e558a8e8bcf37ae87715b11
facevate,False,fare,to do/make,verb,you (plural) were doing/making,"core,verb",,2p,,plural,indicative,imperfect,False,False,False,,,,,,Voi facevate pratica ogni sera.,You practiced every evening.,a7a079383db1a68a0f6f9ca633b4f8de26e071e295f775e72907057727579944,aaf7b40f4ab31926fe3f58b25f68ec6f07452aba7a8eeb4373f3b1c3bd428d35
facevano,False,fare,to do/make,verb,they were doing/making,"core,verb",,3p,,plural,indicative,imperfect,False,False,False,,,,,,Loro facevano silenzio.,They kept quiet.,67ea96daea4ca2751befc0cf41dad1ab9a920da8d4604a36c085b8b5368700c9,df0bee66e1d333074c06975d4921de3249d2253d767da45b564f448716e25741
ho fatto,False,fare,to do/make,verb,I have done/made,"core,verb",,1s,,singular,indicative,passato prossimo,False,False,True,,,,,used with auxiliary avere; past participle 'fatto',Ho fatto una torta.,I made a cake.,bfad97b93124fa28ba270c6d3fbb288912b9198bdcd8915bb2a1c171d8b32325,c036f07c20a69748b003a3b7177aa780f4a27afb818ddc3030a1bc46ad94ede2
hai fatto,False,fare,to do/make,verb,you have done/made,"core,verb",,2s,,singular,indicative,passato prossimo,False,False,True,,,,,used with auxiliary avere; past participle 'fatto',Hai fatto bene.,You did well.,7d9c4619e3da794e2f4d65ca98a91d671680333a72789aa44a5154410efaf96c,f457b3c7cc2b4f3ec27b9d95d1bde189b20a58912f5478b94691bcec3b3dba35
ha fatto,False,fare,to do/make,verb,he has done/made/she has done/made/you (formal) have done/made,"core,verb",,3s,,singular,indicative,passato prossimo,False,False,True,,,,,used with auxiliary avere; past participle 'fatto'; also used as formal 'Lei',Ha fatto tardi.,He was late.,2e51f05eb18242e5eb2ce7e5ea983426e4a9ea4dd61c1019c8b71ad0df86b1d1,f3c90fcbae01e1c6c37eb91b0f3b6f612e043795585237f6ace5a21f1335953f
abbiamo fatto,False,fare,to do/make,verb,we have done/made,"core,verb",,1p,,plural,indicative,passato prossimo,False,False,True,,,,,used with auxiliary avere; past participle 'fatto',Abbiamo fatto una pausa.,We took a break.,efa473b6404c3137b52af5864fff713753cb696f211336f7a7d4763cdad22d83,cfc52facd6a5410d9ff01f039ac238f31a56efc15a1be10da5092eb8c111d307
avete fatto,False,fare,to do/make,verb,you (plural) have done/made,"core,verb",,2p,,plural,indicative,passato prossimo,False,False,True,,,,,used with auxiliary avere; past participle 'fatto',Avete fatto i compiti?,Did you do your homework?,5b2b58e9de27ad55c3e6331fbe98f4bcbcd13beb83bb586a4666b323b6eff688,2775580aafecd2c1eea519140dece78b236bf3729af6d065ff4dd1185f25ec3f
hanno fatto,False,fare,to do/make,verb,they have done/made,"core,verb",,3p,,plural,indicative,passato prossimo,False,False,True,,,,,used with auxiliary avere; past participle 'fatto',Hanno fatto un viaggio.,They took a trip.,8466c8a7dcb98c099a4d8ee096289e483362bb2add495bb7f3e9248c437ff5a1,1f7fde0cc96f4e5f20b522b789e169a08ff12988e40140ef378f644d9a225767
fece,False,fare,to do/make,verb,he did/he made/she did/ she made/you (formal) did/you (formal) made,"core,verb",,3s,,singular,indicative,passato remoto,False,False,False,,,,,passato remoto; also used as formal 'Lei',Lui fece una telefonata.,He made a phone call.,2acf0277980fca591505612e30bde346f4663939507f5d0180b393ca1d0dbb47,f9f368566088a20d98fb65f8e4b33245cf015a87c32e2eb54b3a27b150aae05f
