term_italian,is_base,base_lemma_italian,base_lemma_english,part_of_speech,translation_english,topics,subtype,person_number,gender,plurality,mood,tense,is_comparative,is_superlative,is_compound,article_type,article_italian,added_particle_italian,preposition,notes,example_sentence_italian,example_sentence_english,english_audio_hash,english_duration_ms,italian_audio_hash,italian_duration_ms
rompere,True,rompere,to break,verb,to break,"core,verb",,,,,non-finite,infinitive,False,False,False,,,,,irregular past participle 'rotto'; transitive verb,Devo rompere il vetro.,I need to break the glass.,390677da571624660bb35360c6f571cb22a5381990948dcd75253baf4b633b73,1200.0,2bfbcd01b4592fd8d5b4167fb213b8b0265c99cbe372aa5f11cd1119e0209e14,1392.0
rotto,False,rompere,to break,verb,broken,"core,verb",,,masculine,singular,participle,past,False,False,False,,,,,past participle (masculine singular); used with avere; irregular,L'ho rotto.,I have broken it.,248e66585a3e45a2948a84a43aa44d1da30c64930f8da0d0dae9e5ada63a0671,1152.0,98b4d3a5f37203340a94e946670c220ccd1d5caca82d5a5c524332815511b5b1,1320.0
rotta,False,rompere,to break,verb,broken,"core,verb",,,feminine,singular,participle,past,False,False,False,,,,,past participle (feminine singular); agrees with subject or object when used with essere or reflexive,La finestra si è rotta.,The window broke.,248e66585a3e45a2948a84a43aa44d1da30c64930f8da0d0dae9e5ada63a0671,1152.0,ef0276137f4f678a046ba5df6dd9aa6b68c4f0e969822f4b27d40b01649b575e,1320.0
rotti,False,rompere,to break,verb,broken,"core,verb",,,masculine,plural,participle,past,False,False,False,,,,,past participle (masculine plural),Li ho rotti.,I have broken them.,248e66585a3e45a2948a84a43aa44d1da30c64930f8da0d0dae9e5ada63a0671,1152.0,8c1f20846794b00ae9422daecce37feadc70b910ea801649d54158ffc8c2a015,1296.0
rotte,False,rompere,to break,verb,broken,"core,verb",,,feminine,plural,participle,past,False,False,False,,,,,past participle (feminine plural),Le ho rotte.,I have broken them.,248e66585a3e45a2948a84a43aa44d1da30c64930f8da0d0dae9e5ada63a0671,1152.0,0143deee2fc4878644e9c5981716c8382e8d4df506f485ec8ad0e398e2c5d455,1296.0
si è rotta,False,rompere,to break,verb,she has broken/it has broken,"core,verb",,3s,feminine,singular,indicative,passato prossimo,False,False,True,,,,,compound with essere when reflexive or when subject experiences the action; agrees in gender/number,La finestra si è rotta.,The window broke.,46fb5f2b4a4b19e5d40998179dc3f595c851af3c779a952d80e9e723e0c5acb4,2976.0,9d730be95d9e622ac7053f22ab8272125a33b0cd1233375a05e30770f3b2bbf8,1632.0
