term_italian,is_base,base_lemma_italian,base_lemma_english,part_of_speech,translation_english,topics,subtype,person_number,gender,plurality,mood,tense,is_comparative,is_superlative,is_compound,article_type,article_italian,added_particle_italian,preposition,notes,example_sentence_italian,example_sentence_english
rompere,True,rompere,to break,verb,to break,"core,verb",,,,,non-finite,infinitive,False,False,False,,,,,irregular past participle 'rotto'; transitive verb,Devo rompere il vetro.,I need to break the glass.
rotto,False,rompere,to break,verb,broken,"core,verb",,,masculine,singular,participle,past,False,False,False,,,,,past participle (masculine singular); used with avere; irregular,L'ho rotto.,I have broken it.
rotta,False,rompere,to break,verb,broken,"core,verb",,,feminine,singular,participle,past,False,False,False,,,,,past participle (feminine singular); agrees with subject or object when used with essere or reflexive,La finestra si è rotta.,The window broke.
rotti,False,rompere,to break,verb,broken,"core,verb",,,masculine,plural,participle,past,False,False,False,,,,,past participle (masculine plural),Li ho rotti.,I have broken them.
rotte,False,rompere,to break,verb,broken,"core,verb",,,feminine,plural,participle,past,False,False,False,,,,,past participle (feminine plural),Le ho rotte.,I have broken them.
si è rotta,False,rompere,to break,verb,she has broken/it has broken,"core,verb",,3s,feminine,singular,indicative,passato prossimo,False,False,True,,,,,compound with essere when reflexive or when subject experiences the action; agrees in gender/number,La finestra si è rotta.,The window broke.
