term_italian,is_base,base_lemma_italian,base_lemma_english,part_of_speech,translation_english,topics,subtype,person_number,gender,plurality,mood,tense,is_comparative,is_superlative,is_compound,article_type,article_italian,added_particle_italian,preposition,notes,example_sentence_italian,example_sentence_english,italian_audio_hash,english_audio_hash
venire,True,venire,to come,verb,to come,"core,verb",,,,,non-finite,infinitive,False,False,False,,,,,irregular verb; auxiliary essere in compound tenses,Voglio venire presto.,I want to come early.,cade4ce0a5767665940efbc82bd30064c5c4f17dd62b0ab6519f95064997782a,544b0cbb161c82ba95fc71b7caae9a6d8b66ce0a96fe1b958f830059319d94d0
venendo,False,venire,to come,verb,coming,"core,verb",,,,,gerund,,False,False,False,,,,,gerund form,Sto venendo adesso.,I am coming now.,25e2ae7965c9789535481c512c967345ec525e38e0eadf8cacddbfe6dd7e6c0e,8ce5cf2ca0fce1005698bcbde9cee1164de9d7ec9d12d3f9a748eee7764b5523
venuto,False,venire,to come,verb,come,"core,verb",,,masculine,singular,participle,past,False,False,False,,,,,past participle; agrees with subject; auxiliary essere,Lui è venuto ieri.,He came yesterday.,ef6aefcf5d143933c74aa79cf6624d9861d3a74d27b116f5dcb8d255daa97a3d,844643d5ce44bfcea1842998820b2dea3357e9a75e3533f348269e81e95e1b89
venuta,False,venire,to come,verb,come,"core,verb",,,feminine,singular,participle,past,False,False,False,,,,,past participle; agrees with subject; auxiliary essere,Lei è venuta ieri.,She came yesterday.,1d360b02925c859109ef223a9f4e7c4e0708330591ce36b03ce5a37323e13f63,844643d5ce44bfcea1842998820b2dea3357e9a75e3533f348269e81e95e1b89
venuti,False,venire,to come,verb,come,"core,verb",,,masculine,plural,participle,past,False,False,False,,,,,past participle; agrees with subject; auxiliary essere,Loro sono venuti ieri.,They came yesterday.,620163cf8158ccd1656445b75f3c9a1916403cadb3ca3de331c1a5fc00e0ba53,844643d5ce44bfcea1842998820b2dea3357e9a75e3533f348269e81e95e1b89
venute,False,venire,to come,verb,come,"core,verb",,,feminine,plural,participle,past,False,False,False,,,,,past participle; agrees with subject; auxiliary essere,Loro sono venute ieri.,They came yesterday.,eae97470c6dcf6658a6484af94efc8801228e08c692d02bf116fbf20c435379d,844643d5ce44bfcea1842998820b2dea3357e9a75e3533f348269e81e95e1b89
vengo,False,venire,to come,verb,I come,"core,verb",,1s,,singular,indicative,present,False,False,False,,,,,irregular present stem,Io vengo subito.,I am coming right away.,1a799e621674488a1b7fd3cc44d80c58a8e1f7b96c53570a9441df482372196f,5acf82cfbe5151406206d25943d97b4617a00ceb3880928f621e5c08f609aeec
vieni,False,venire,to come,verb,you come,"core,verb",,2s,,singular,indicative,present,False,False,False,,,,,irregular present stem,Tu vieni con me?,Are you coming with me?,fd281dfa1e9bdc42ff1046110b5eb42068d81b88fc0265ee03c8809c5fa28b66,bc71d05c3096b6a1863fcdfa32d75e0d3649c5402b4334cdf6f106f8cf86305c
viene,False,venire,to come,verb,he comes/she comes/you (formal) come,"core,verb",,3s,,singular,indicative,present,False,False,False,,,,,also used as formal 'Lei'; irregular present stem,Oggi viene anche Marco.,Today Marco also comes.,42fa6dbd1e4538855dcd053f43d5f3d6c9af6270c9ac4b193d949b0b92f188b1,0e991b9091717cdd240e8ab505892b0455a28e4d8a86e57163b8a29efcadfebd
veniamo,False,venire,to come,verb,we come,"core,verb",,1p,,plural,indicative,present,False,False,False,,,,,,Noi veniamo domani.,We come tomorrow.,ecfe5822c4f52329ff571309ff6ae4ea41cf8b665bb169bbc697611ce5b0efea,6b59aa88e96d16fc941d6f2513f63a966bcff1f80ee3b04cb04412a314588779
venite,False,venire,to come,verb,you (plural) come,"core,verb",,2p,,plural,indicative,present,False,False,False,,,,,,Voi venite spesso qui?,Do you come here often?,8776bc52916fd07164bc7a1dd15dddb9053bacd5f94bfb3212a36c1e2d46a285,9e1582f2bec31b658b2058f46699af3394204ab47a00582eb7da2b8d8cdaea3c
vengono,False,venire,to come,verb,they come,"core,verb",,3p,,plural,indicative,present,False,False,False,,,,,,Loro vengono da lontano.,They come from far away.,8fe8b527ca387ff6369cf52b2eef2e844bd3cc912a08497852011dc8c289f3d3,df68462129ed9a6d5df536c381107a166e12f58dd393c0e554a2999f7960c193
venivo,False,venire,to come,verb,I was coming,"core,verb",,1s,,singular,indicative,imperfect,False,False,False,,,,,,Io venivo spesso qui.,I was coming here often.,1d89d094dab95285a38f0ec0a26e595f8fcbeb024328e116b462185a92ac8f4f,4fbd839a9e931278cf6b4d3cdee54878802a30672820abe3b6cdfad95fc586e8
venivi,False,venire,to come,verb,you were coming,"core,verb",,2s,,singular,indicative,imperfect,False,False,False,,,,,,Tu venivi a trovarci.,You were coming to visit us.,e9921775f198d109379f54f311ee67679950282939bdc27fc9d5f9a8e3190494,37f85b80069d763b9221d1ae113a8d28492fcc39c08799a154f37cc802725e64
veniva,False,venire,to come,verb,he was coming/she was coming/you (formal) were coming,"core,verb",,3s,,singular,indicative,imperfect,False,False,False,,,,,also used as formal 'Lei',Ogni estate veniva qui.,Every summer he came here.,bdfd095f84cb261ded90f132aad2f35c72e5c624e26decb2e355d15b35ffe68a,7f7e98769130aa1f80f36a44d9c1928ad2d5751f6acf9b88e8247892f3684678
venivamo,False,venire,to come,verb,we were coming,"core,verb",,1p,,plural,indicative,imperfect,False,False,False,,,,,,Noi venivamo insieme.,We were coming together.,39107c954a438925153f974b62ea15f6977b7b92607ab3fef005fa43496c11f5,be7f249433a9b8d4bd2f2cf9ba82b9a370eff779b00a60e24f0ff6f420c4e4d2
venivate,False,venire,to come,verb,you (plural) were coming,"core,verb",,2p,,plural,indicative,imperfect,False,False,False,,,,,,Voi venivate in treno.,You were coming by train.,695c61413a1fa802a5dce01935a624689c21ae84ffe60a51540ff87551502c22,379da0486290e75595d8a4ab635af27baab709dea8ab569ccbbf4c751d070e66
venivano,False,venire,to come,verb,they were coming,"core,verb",,3p,,plural,indicative,imperfect,False,False,False,,,,,,Spesso venivano tardi.,They were often coming late.,8c7525f4b377ae05f9cab900f4af12b60ab9bfe6d43f401456c42708d68f0df1,41adff837b8b5b121017724a7482ed70621dbedcffdbdd1aa8ea96d205342651
sono venuto,False,venire,to come,verb,I have come,"core,verb",,1s,masculine,singular,indicative,passato prossimo,False,False,True,,,,,used with auxiliary essere; participle agrees with subject,Io sono venuto presto.,I have come early.,17a134003815d25cda14391eff350ec00e94e83b07f94f5183be9a59eb610a3f,7044f256b042c4cba58fbe1829aa7320653263e1b2e3316baf12e0f72f4b0a68
sono venuta,False,venire,to come,verb,I have come,"core,verb",,1s,feminine,singular,indicative,passato prossimo,False,False,True,,,,,used with auxiliary essere; participle agrees with subject,Io sono venuta presto.,I have come early.,f7a4787b8abd3c7da4f810ffc11915ec95f72687e44119fe83a1685fe562b053,7044f256b042c4cba58fbe1829aa7320653263e1b2e3316baf12e0f72f4b0a68
sei venuto,False,venire,to come,verb,you have come,"core,verb",,2s,masculine,singular,indicative,passato prossimo,False,False,True,,,,,used with auxiliary essere; participle agrees with subject,Tu sei venuto con noi.,You have come with us.,4dcc8ec5bbb98e75e0cbe8255142962ee91b8865d6f5669de972d405186e4bef,8f7e2c2a86b1520e6d936e8d36227aec5e340cd36edd5b7897f65326769ee01d
sei venuta,False,venire,to come,verb,you have come,"core,verb",,2s,feminine,singular,indicative,passato prossimo,False,False,True,,,,,used with auxiliary essere; participle agrees with subject,Tu sei venuta con noi.,You have come with us.,a91bb9f4104a84be0e2f2a001cc270b67a2324d7eb78ef04ccfc63e08d6c5113,8f7e2c2a86b1520e6d936e8d36227aec5e340cd36edd5b7897f65326769ee01d
è venuto,False,venire,to come,verb,he has come/you (formal) have come,"core,verb",,3s,masculine,singular,indicative,passato prossimo,False,False,True,,,,,used with auxiliary essere; participle agrees with subject; also used as formal Lei,Oggi è venuto da te.,Today he has come to your place.,993bec70eb3a9034690eedb880c7ba98c0785c5f62215fb307182b962841812a,27fb7ca1ff78088ca838b965b41ef46b733866078544edc86032f2ce69f2803f
è venuta,False,venire,to come,verb,she has come/you (formal) have come,"core,verb",,3s,feminine,singular,indicative,passato prossimo,False,False,True,,,,,used with auxiliary essere; participle agrees with subject; also used as formal Lei,Oggi è venuta da te.,Today she has come to your place.,2974c0fca6422ae2c4b12e153133e6bad4cc0c44d0c8dd404653c151caf8da98,6f7b156ac4ae9bdfcf34ca2ca7fce616ef39758fc50c5fc7e218e191715b0198
siamo venuti,False,venire,to come,verb,we have come,"core,verb",,1p,masculine,plural,indicative,passato prossimo,False,False,True,,,,,used with auxiliary essere; participle agrees with subject,Noi siamo venuti insieme.,We have come together.,b83b1c4d5bc9b344985576816b292c9922c7743d00da67ae84bd2b00a7acbd09,929625eff479fc78d33a10dca7d490f85413435dba2c2aebd9c8062da6df9887
siamo venute,False,venire,to come,verb,we have come,"core,verb",,1p,feminine,plural,indicative,passato prossimo,False,False,True,,,,,used with auxiliary essere; participle agrees with subject,Noi siamo venute insieme.,We have come together.,a425c78cf01b60467ef848ff9cd508e77f193f14fba4f33301e6b1b8a383d6c7,929625eff479fc78d33a10dca7d490f85413435dba2c2aebd9c8062da6df9887
siete venuti,False,venire,to come,verb,you (plural) have come,"core,verb",,2p,masculine,plural,indicative,passato prossimo,False,False,True,,,,,used with auxiliary essere; participle agrees with subject,Voi siete venuti a casa.,You have come home.,603a386b8d4783896967bd114ba7f13d0fc4646d87253f3dcb61829f737b0858,b9ff7502d9575c2c260ca064e37c0774ff7ea674f2a7642ea4673947a7376a29
siete venute,False,venire,to come,verb,you (plural) have come,"core,verb",,2p,feminine,plural,indicative,passato prossimo,False,False,True,,,,,used with auxiliary essere; participle agrees with subject,Voi siete venute a casa.,You have come home.,b38254df5b3779fa9a3362fa9eb45b1d337e62fa64d11b165f2c8b887a44969f,b9ff7502d9575c2c260ca064e37c0774ff7ea674f2a7642ea4673947a7376a29
sono venuti,False,venire,to come,verb,they have come,"core,verb",,3p,masculine,plural,indicative,passato prossimo,False,False,True,,,,,used with auxiliary essere; participle agrees with subject,Loro sono venuti tutti.,They have all come.,020d6df06441eb9df3251ff4c022b35da28160657ff692893fbe77d848c30843,cb93ce5ed4646c73036043367d99f64e76b8d0710584d01acb2e96b414bd6b3b
sono venute,False,venire,to come,verb,they have come,"core,verb",,3p,feminine,plural,indicative,passato prossimo,False,False,True,,,,,used with auxiliary essere; participle agrees with subject,Loro sono venute tutte.,They have all come.,d78a1820c3127a75b32942d0d5c4b9ee490c930fa6bacfaac14fd1224bd53bc8,cb93ce5ed4646c73036043367d99f64e76b8d0710584d01acb2e96b414bd6b3b
