term_italian,is_base,base_lemma_italian,part_of_speech,translation_english,topics,subtype,person_number,gender,plurality,mood,tense,is_comparative,is_superlative,is_compound,article_type,article_italian,added_particle_italian,preposition,notes,example_sentence_italian,example_sentence_english
avete pensato,false,pensare,verb,you (plural) have thought / you (plural) thought (masculine plural),"thought,opinion",n/a,2p,masculine,plural,indicative,passato_prossimo,false,false,true,n/a,n/a,n/a,n/a,used with auxiliary 'avere' to form compound tenses; past participle normally does not agree with subject,Voi avete pensato a tutto.,You (plural) have thought of everything.
avete pensato,false,pensare,verb,you (plural) have thought / you (plural) thought (feminine plural),"thought,opinion",n/a,2p,feminine,plural,indicative,passato_prossimo,false,false,true,n/a,n/a,n/a,n/a,used with auxiliary 'avere' to form compound tenses; past participle normally does not agree with subject,Voi avete pensato alle soluzioni.,You (plural) have thought of the solutions.
hanno pensato,false,pensare,verb,they have thought / they thought (masculine plural),"thought,opinion",n/a,3p,masculine,plural,indicative,passato_prossimo,false,false,true,n/a,n/a,n/a,n/a,used with auxiliary 'avere' to form compound tenses; past participle normally does not agree with subject,Loro hanno pensato a un cambiamento.,They have thought about a change.
hanno pensato,false,pensare,verb,they have thought / they thought (feminine plural),"thought,opinion",n/a,3p,feminine,plural,indicative,passato_prossimo,false,false,true,n/a,n/a,n/a,n/a,used with auxiliary 'avere' to form compound tenses; past participle normally does not agree with subject,Loro hanno pensato alle opzioni.,They have thought about the options.
potere,true,potere,verb,to be able to/can,"ability,permission",n/a,n/a,n/a,n/a,non-finite,infinitive,false,false,false,n/a,n/a,n/a,n/a,base lemma,Voglio potere aiutare.,I want to be able to help.
potendo,false,potere,verb,being able,"ability,permission",n/a,n/a,n/a,n/a,non-finite,gerund,false,false,false,n/a,n/a,n/a,n/a,n/a,Sto potendo lavorare.,I am being able to work.
potute,false,potere,verb,been able (feminine plural),"ability,permission",n/a,n/a,feminine,plural,non-finite,participle,false,false,false,n/a,n/a,n/a,n/a,used with auxiliary 'avere' to form compound tenses,Le ho potute vedere.,I was able to see them.
potuta,false,potere,verb,been able (feminine singular),"ability,permission",n/a,n/a,feminine,singular,non-finite,participle,false,false,false,n/a,n/a,n/a,n/a,used with auxiliary 'avere' to form compound tenses,L'ho potuta finire.,I was able to finish it.
potuti,false,potere,verb,been able (masculine plural),"ability,permission",n/a,n/a,masculine,plural,non-finite,participle,false,false,false,n/a,n/a,n/a,n/a,used with auxiliary 'avere' to form compound tenses,Li ho potuti vedere.,I was able to see them.
potuto,false,potere,verb,been able (masculine singular),"ability,permission",n/a,n/a,masculine,singular,non-finite,participle,false,false,false,n/a,n/a,n/a,n/a,used with auxiliary 'avere' to form compound tenses,Ho potuto farlo.,I was able to do it.
posso,false,potere,verb,I can,"ability,permission",n/a,1s,n/a,singular,indicative,present,false,false,false,n/a,n/a,n/a,n/a,n/a,Posso entrare.,I can enter.
puoi,false,potere,verb,you can,"ability,permission",n/a,2s,n/a,singular,indicative,present,false,false,false,n/a,n/a,n/a,n/a,n/a,Puoi venire.,You can come.
può,false,potere,verb,he/she/it can,"ability,permission",n/a,3s,n/a,singular,indicative,present,false,false,false,n/a,n/a,n/a,n/a,also 'you (formal)',Può aspettare.,He can wait.
possiamo,false,potere,verb,we can,"ability,permission",n/a,1p,n/a,plural,indicative,present,false,false,false,n/a,n/a,n/a,n/a,n/a,Possiamo aiutare.,We can help.
potete,false,potere,verb,you (plural) can,"ability,permission",n/a,2p,n/a,plural,indicative,present,false,false,false,n/a,n/a,n/a,n/a,n/a,Potete entrare.,You (plural) can enter.
possono,false,potere,verb,they can,"ability,permission",n/a,3p,n/a,plural,indicative,present,false,false,false,n/a,n/a,n/a,n/a,n/a,Possono restare.,They can stay.
potevo,false,potere,verb,I could,"ability,permission",n/a,1s,n/a,singular,indicative,imperfect,false,false,false,n/a,n/a,n/a,n/a,n/a,Io potevo guidare.,I could drive.
potevi,false,potere,verb,you could,"ability,permission",n/a,2s,n/a,singular,indicative,imperfect,false,false,false,n/a,n/a,n/a,n/a,n/a,Tu potevi venire.,You could come.
poteva,false,potere,verb,he/she/it could,"ability,permission",n/a,3s,n/a,singular,indicative,imperfect,false,false,false,n/a,n/a,n/a,n/a,also 'you (formal)',Poteva parlare.,He could speak.
potevamo,false,potere,verb,we could,"ability,permission",n/a,1p,n/a,plural,indicative,imperfect,false,false,false,n/a,n/a,n/a,n/a,n/a,Potevamo uscire.,We could go out.
potevate,false,potere,verb,you (plural) could,"ability,permission",n/a,2p,n/a,plural,indicative,imperfect,false,false,false,n/a,n/a,n/a,n/a,n/a,Potevate vedere.,You (plural) could see.
potevano,false,potere,verb,they could,"ability,permission",n/a,3p,n/a,plural,indicative,imperfect,false,false,false,n/a,n/a,n/a,n/a,n/a,Potevano lavorare.,They could work.
ho potuto,false,potere,verb,I was able to / I have been able to,"ability,permission",n/a,1s,n/a,singular,indicative,passato_prossimo,false,false,true,n/a,n/a,n/a,n/a,uses auxiliary 'avere'; no agreement with subject,Ho potuto entrare.,I was able to enter.
hai potuto,false,potere,verb,you were able to / you have been able to,"ability,permission",n/a,2s,n/a,singular,indicative,passato_prossimo,false,false,true,n/a,n/a,n/a,n/a,uses auxiliary 'avere'; no agreement with subject,Hai potuto finire.,You were able to finish.
ha potuto,false,potere,verb,he/she/it was able to / has been able to,"ability,permission",n/a,3s,n/a,singular,indicative,passato_prossimo,false,false,true,n/a,n/a,n/a,n/a,uses auxiliary 'avere'; no agreement with subject; also 'you (formal)',Ha potuto parlare.,He has been able to speak.
abbiamo potuto,false,potere,verb,we were able to / we have been able to,"ability,permission",n/a,1p,n/a,plural,indicative,passato_prossimo,false,false,true,n/a,n/a,n/a,n/a,uses auxiliary 'avere'; no agreement with subject,Abbiamo potuto aiutare.,We have been able to help.
avete potuto,false,potere,verb,you (plural) were able to / you (plural) have been able to,"ability,permission",n/a,2p,n/a,plural,indicative,passato_prossimo,false,false,true,n/a,n/a,n/a,n/a,uses auxiliary 'avere'; no agreement with subject,Avete potuto venire.,You (plural) were able to come.
hanno potuto,false,potere,verb,they were able to / they have been able to,"ability,permission",n/a,3p,n/a,plural,indicative,passato_prossimo,false,false,true,n/a,n/a,n/a,n/a,uses auxiliary 'avere'; no agreement with subject,Hanno potuto entrare.,They have been able to enter.
prendere,true,prendere,verb,to take,"actions,possession",n/a,n/a,n/a,n/a,non-finite,infinitive,false,false,false,n/a,n/a,n/a,n/a,base lemma,Voglio prendere quel treno.,I want to take that train.
prendendo,false,prendere,verb,taking,"actions,possession",n/a,n/a,n/a,n/a,non-finite,gerund,false,false,false,n/a,n/a,n/a,n/a,n/a,Sto prendendo appunti.,I am taking notes.
preso,false,prendere,verb,taken (masculine singular),"actions,possession",n/a,n/a,masculine,singular,non-finite,participle,false,false,false,n/a,n/a,n/a,n/a,used with auxiliary 'avere' to form compound tenses,Il libro è stato preso.,The book was taken.
presa,false,prendere,verb,taken (feminine singular),"actions,possession",n/a,n/a,feminine,singular,non-finite,participle,false,false,false,n/a,n/a,n/a,n/a,used with auxiliary 'avere' to form compound tenses,La decisione è stata presa.,The decision was taken.
presi,false,prendere,verb,taken (masculine plural),"actions,possession",n/a,n/a,masculine,plural,non-finite,participle,false,false,false,n/a,n/a,n/a,n/a,used with auxiliary 'avere' to form compound tenses,I documenti sono stati presi.,The documents were taken.
prese,false,prendere,verb,taken (feminine plural),"actions,possession",n/a,n/a,feminine,plural,non-finite,participle,false,false,false,n/a,n/a,n/a,n/a,used with auxiliary 'avere' to form compound tenses,Le valigie sono state prese.,The suitcases were taken.
prendo,false,prendere,verb,I take,"actions,possession",n/a,1s,n/a,singular,indicative,present,false,false,false,n/a,n/a,n/a,n/a,n/a,Io prendo il caffè ogni mattina.,I take coffee every morning.
prendi,false,prendere,verb,you take,"actions,possession",n/a,2s,n/a,singular,indicative,present,false,false,false,n/a,n/a,n/a,n/a,n/a,Tu prendi l'autobus.,You take the bus.
prende,false,prendere,verb,he/she/it takes,"actions,possession",n/a,3s,n/a,singular,indicative,present,false,false,false,n/a,n/a,n/a,n/a,also 'you (formal)',Lui prende sempre appunti.,He always takes notes.
prendiamo,false,prendere,verb,we take,"actions,possession",n/a,1p,n/a,plural,indicative,present,false,false,false,n/a,n/a,n/a,n/a,n/a,Noi prendiamo decisioni insieme.,We make decisions together.
prendete,false,prendere,verb,you (plural) take,"actions,possession",n/a,2p,n/a,plural,indicative,present,false,false,false,n/a,n/a,n/a,n/a,n/a,Voi prendete il treno domani.,You (plural) take the train tomorrow.
prendono,false,prendere,verb,they take,"actions,possession",n/a,3p,n/a,plural,indicative,present,false,false,false,n/a,n/a,n/a,n/a,n/a,Loro prendono le lezioni online.,They take the lessons online.
prendevo,false,prendere,verb,I was taking,"actions,possession",n/a,1s,n/a,singular,indicative,imperfect,false,false,false,n/a,n/a,n/a,n/a,n/a,Io prendevo sempre il sentiero lungo.,I always used to take the long path.
prendevi,false,prendere,verb,you were taking,"actions,possession",n/a,2s,n/a,singular,indicative,imperfect,false,false,false,n/a,n/a,n/a,n/a,n/a,Tu prendevi parte alla riunione.,You were taking part in the meeting.
prendeva,false,prendere,verb,he/she/it was taking,"actions,possession",n/a,3s,n/a,singular,indicative,imperfect,false,false,false,n/a,n/a,n/a,n/a,also 'you (formal)',Lei prendeva appunti lentamente.,She was taking notes slowly.
prendevamo,false,prendere,verb,we were taking,"actions,possession",n/a,1p,n/a,plural,indicative,imperfect,false,false,false,n/a,n/a,n/a,n/a,n/a,Noi prendevamo il sole in spiaggia.,We were sunbathing on the beach.
prendevate,false,prendere,verb,you (plural) were taking,"actions,possession",n/a,2p,n/a,plural,indicative,imperfect,false,false,false,n/a,n/a,n/a,n/a,n/a,Voi prendevate decisioni affrettate.,You (plural) were making hasty decisions.
prendevano,false,prendere,verb,they were taking,"actions,possession",n/a,3p,n/a,plural,indicative,imperfect,false,false,false,n/a,n/a,n/a,n/a,n/a,Loro prendevano le provviste per il viaggio.,They were taking supplies for the trip.
ho preso,false,prendere,verb,I have taken / I took,"actions,possession",n/a,1s,masculine,singular,indicative,passato_prossimo,false,false,true,n/a,n/a,n/a,n/a,uses auxiliary 'avere' to form compound tenses; past participle normally invariable,Ho preso il tuo libro.,I have taken your book.
ho preso,false,prendere,verb,I have taken / I took,"actions,possession",n/a,1s,feminine,singular,indicative,passato_prossimo,false,false,true,n/a,n/a,n/a,n/a,uses auxiliary 'avere' to form compound tenses; past participle normally invariable,Ho preso la tua giacca.,I have taken your jacket.
hai preso,false,prendere,verb,you have taken / you took,"actions,possession",n/a,2s,masculine,singular,indicative,passato_prossimo,false,false,true,n/a,n/a,n/a,n/a,uses auxiliary 'avere' to form compound tenses; past participle normally invariable,Hai preso il biglietto?,Did you take the ticket?
hai preso,false,prendere,verb,you have taken / you took,"actions,possession",n/a,2s,feminine,singular,indicative,passato_prossimo,false,false,true,n/a,n/a,n/a,n/a,uses auxiliary 'avere' to form compound tenses; past participle normally invariable,Hai preso la mia borsa?,Did you take my bag?
ha preso,false,prendere,verb,he/she/it has taken / he/she/it took,"actions,possession",n/a,3s,masculine,singular,indicative,passato_prossimo,false,false,true,n/a,n/a,n/a,n/a,uses auxiliary 'avere' to form compound tenses; past participle normally invariable; also 'you (formal)',Ha preso il treno stamattina.,He took the train this morning.
ha preso,false,prendere,verb,he/she/it has taken / he/she/it took,"actions,possession",n/a,3s,feminine,singular,indicative,passato_prossimo,false,false,true,n/a,n/a,n/a,n/a,uses auxiliary 'avere' to form compound tenses; past participle normally invariable; also 'you (formal)',Ha preso la decisione giusta.,She made the right decision.
abbiamo preso,false,prendere,verb,we have taken / we took,"actions,possession",n/a,1p,masculine,plural,indicative,passato_prossimo,false,false,true,n/a,n/a,n/a,n/a,uses auxiliary 'avere' to form compound tenses; past participle normally invariable,Abbiamo preso due taxi.,We took two taxis.
abbiamo preso,false,prendere,verb,we have taken / we took,"actions,possession",n/a,1p,feminine,plural,indicative,passato_prossimo,false,false,true,n/a,n/a,n/a,n/a,uses auxiliary 'avere' to form compound tenses; past participle normally invariable,Abbiamo preso le chiavi.,We took the keys.
avete preso,false,prendere,verb,you (plural) have taken / you (plural) took,"actions,possession",n/a,2p,masculine,plural,indicative,passato_prossimo,false,false,true,n/a,n/a,n/a,n/a,uses auxiliary 'avere' to form compound tenses; past participle normally invariable,Avete preso le foto?,Did you (pl.) take the photos?
avete preso,false,prendere,verb,you (plural) have taken / you (plural) took,"actions,possession",n/a,2p,feminine,plural,indicative,passato_prossimo,false,false,true,n/a,n/a,n/a,n/a,uses auxiliary 'avere' to form compound tenses; past participle normally invariable,Avete preso le borse al controllo?,Did you (pl.) take the bags at security?
hanno preso,false,prendere,verb,they have taken / they took,"actions,possession",n/a,3p,masculine,plural,indicative,passato_prossimo,false,false,true,n/a,n/a,n/a,n/a,uses auxiliary 'avere' to form compound tenses; past participle normally invariable,Hanno preso i soldi.,They took the money.
hanno preso,false,prendere,verb,they have taken / they took,"actions,possession",n/a,3p,feminine,plural,indicative,passato_prossimo,false,false,true,n/a,n/a,n/a,n/a,uses auxiliary 'avere' to form compound tenses; past participle normally invariable,Hanno preso le misure.,They took the measurements.
sapere,true,sapere,verb,to know (a fact,how to),n/a,infinitive,n/a,n/a,"knowledge,ability",non-finite,false,false,false,n/a,n/a,n/a,n/a,false,base lemma,Voglio sapere la verità.
sapendo,false,sapere,verb,knowing,"knowledge,ability",n/a,n/a,n/a,n/a,non-finite,gerund,false,false,false,n/a,n/a,n/a,n/a,n/a,"Sapendo quello che è successo, ho cambiato idea.","Knowing what happened, I changed my mind."
sapute,false,sapere,verb,known (feminine plural),"knowledge,ability",n/a,n/a,feminine,plural,non-finite,participle,false,false,false,n/a,n/a,n/a,n/a,used with auxiliary 'avere' to form compound tenses,Le ho sapute tutte.,I found out them all.
saputa,false,sapere,verb,known (feminine singular),"knowledge,ability",n/a,n/a,feminine,singular,non-finite,participle,false,false,false,n/a,n/a,n/a,n/a,used with auxiliary 'avere' to form compound tenses,L'ho saputa subito.,I learned it right away.
saputi,false,sapere,verb,known (masculine plural),"knowledge,ability",n/a,n/a,masculine,plural,non-finite,participle,false,false,false,n/a,n/a,n/a,n/a,used with auxiliary 'avere' to form compound tenses,Li ho saputi pochi giorni fa.,I learned them a few days ago.
saputo,false,sapere,verb,known (masculine singular),"knowledge,ability",n/a,n/a,masculine,singular,non-finite,participle,false,false,false,n/a,n/a,n/a,n/a,used with auxiliary 'avere' to form compound tenses,Ho saputo la notizia.,I found out the news.
so,false,sapere,verb,I know,"knowledge,ability",n/a,1s,n/a,singular,indicative,present,false,false,false,n/a,n/a,n/a,n/a,n/a,Io so la risposta.,I know the answer.
sai,false,sapere,verb,you know,"knowledge,ability",n/a,2s,n/a,singular,indicative,present,false,false,false,n/a,n/a,n/a,n/a,n/a,Tu sai parlare inglese.,You know how to speak English.
sa,false,sapere,verb,he/she/it knows,"knowledge,ability",n/a,3s,n/a,singular,indicative,present,false,false,false,n/a,n/a,n/a,n/a,also 'you (formal)',Lei sa molte cose.,She knows many things.
sappiamo,false,sapere,verb,we know,"knowledge,ability",n/a,1p,n/a,plural,indicative,present,false,false,false,n/a,n/a,n/a,n/a,n/a,Noi sappiamo la verità.,We know the truth.
sapete,false,sapere,verb,you (plural) know,"knowledge,ability",n/a,2p,n/a,plural,indicative,present,false,false,false,n/a,n/a,n/a,n/a,n/a,Voi sapete la risposta.,You (plural) know the answer.
sanno,false,sapere,verb,they know,"knowledge,ability",n/a,3p,n/a,plural,indicative,present,false,false,false,n/a,n/a,n/a,n/a,n/a,Loro sanno nuotare.,They know how to swim.
sapevo,false,sapere,verb,I knew / I used to know,"knowledge,ability",n/a,1s,n/a,singular,indicative,imperfect,false,false,false,n/a,n/a,n/a,n/a,n/a,Io sapevo la verità.,I knew the truth.
sapevi,false,sapere,verb,you knew / you used to know,"knowledge,ability",n/a,2s,n/a,singular,indicative,imperfect,false,false,false,n/a,n/a,n/a,n/a,n/a,Tu sapevi tutto.,You knew everything.
sapeva,false,sapere,verb,he/she/it knew / used to know,"knowledge,ability",n/a,3s,n/a,singular,indicative,imperfect,false,false,false,n/a,n/a,n/a,n/a,also 'you (formal)',Lui sapeva la storia.,He knew the story.
sapevamo,false,sapere,verb,we knew / we used to know,"knowledge,ability",n/a,1p,n/a,plural,indicative,imperfect,false,false,false,n/a,n/a,n/a,n/a,n/a,Noi sapevamo cosa fare.,We knew what to do.
sapevate,false,sapere,verb,you (plural) knew / used to know,"knowledge,ability",n/a,2p,n/a,plural,indicative,imperfect,false,false,false,n/a,n/a,n/a,n/a,n/a,Voi sapevate la data.,You (plural) knew the date.
sapevano,false,sapere,verb,they knew / they used to know,"knowledge,ability",n/a,3p,n/a,plural,indicative,imperfect,false,false,false,n/a,n/a,n/a,n/a,n/a,Loro sapevano la verità.,They knew the truth.
ho saputo,false,sapere,verb,I have known / I learned,"knowledge,ability",n/a,1s,feminine,singular,indicative,passato_prossimo,false,false,true,n/a,n/a,n/a,n/a,uses auxiliary 'avere'; past participle usually does not agree with subject; agreement possible with preceding direct object clitic,Ho saputo la notizia.,I have learned the news.
ho saputo,false,sapere,verb,I have known / I learned,"knowledge,ability",n/a,1s,masculine,singular,indicative,passato_prossimo,false,false,true,n/a,n/a,n/a,n/a,uses auxiliary 'avere'; past participle usually does not agree with subject; agreement possible with preceding direct object clitic,Ho saputo la notizia.,I have learned the news.
hai saputo,false,sapere,verb,you have known / you learned,"knowledge,ability",n/a,2s,feminine,singular,indicative,passato_prossimo,false,false,true,n/a,n/a,n/a,n/a,uses auxiliary 'avere'; past participle usually does not agree with subject; agreement possible with preceding direct object clitic,Hai saputo la verità?,Did you find out the truth?
hai saputo,false,sapere,verb,you have known / you learned,"knowledge,ability",n/a,2s,masculine,singular,indicative,passato_prossimo,false,false,true,n/a,n/a,n/a,n/a,uses auxiliary 'avere'; past participle usually does not agree with subject; agreement possible with preceding direct object clitic,Hai saputo la verità?,Did you find out the truth?
ha saputo,false,sapere,verb,she has known / she learned,"knowledge,ability",n/a,3s,feminine,singular,indicative,passato_prossimo,false,false,true,n/a,n/a,n/a,n/a,uses auxiliary 'avere'; past participle usually does not agree with subject; agreement possible with preceding direct object clitic; also 'you (formal)',Ha saputo la notizia.,She has learned the news.
ha saputo,false,sapere,verb,he has known / he learned,"knowledge,ability",n/a,3s,masculine,singular,indicative,passato_prossimo,false,false,true,n/a,n/a,n/a,n/a,uses auxiliary 'avere'; past participle usually does not agree with subject; agreement possible with preceding direct object clitic; also 'you (formal)',Ha saputo tutto.,He has learned everything.
abbiamo saputo,false,sapere,verb,we have known / we learned,"knowledge,ability",n/a,1p,feminine,plural,indicative,passato_prossimo,false,false,true,n/a,n/a,n/a,n/a,uses auxiliary 'avere'; past participle usually does not agree with subject; agreement possible with preceding direct object clitic,Abbiamo saputo la verità.,We have learned the truth.
abbiamo saputo,false,sapere,verb,we have known / we learned,"knowledge,ability",n/a,1p,masculine,plural,indicative,passato_prossimo,false,false,true,n/a,n/a,n/a,n/a,uses auxiliary 'avere'; past participle usually does not agree with subject; agreement possible with preceding direct object clitic,Abbiamo saputo la verità.,We have learned the truth.
avete saputo,false,sapere,verb,you (plural) have known / you (plural) learned,"knowledge,ability",n/a,2p,feminine,plural,indicative,passato_prossimo,false,false,true,n/a,n/a,n/a,n/a,uses auxiliary 'avere'; past participle usually does not agree with subject; agreement possible with preceding direct object clitic,Avete saputo della festa?,Have you (plural) heard about the party?
avete saputo,false,sapere,verb,you (plural) have known / you (plural) learned,"knowledge,ability",n/a,2p,masculine,plural,indicative,passato_prossimo,false,false,true,n/a,n/a,n/a,n/a,uses auxiliary 'avere'; past participle usually does not agree with subject; agreement possible with preceding direct object clitic,Avete saputo della festa?,Have you (plural) heard about the party?
hanno saputo,false,sapere,verb,they have known / they learned,"knowledge,ability",n/a,3p,feminine,plural,indicative,passato_prossimo,false,false,true,n/a,n/a,n/a,n/a,uses auxiliary 'avere'; past participle usually does not agree with subject; agreement possible with preceding direct object clitic,Hanno saputo la verità.,They have learned the truth.
hanno saputo,false,sapere,verb,they have known / they learned,"knowledge,ability",n/a,3p,masculine,plural,indicative,passato_prossimo,false,false,true,n/a,n/a,n/a,n/a,uses auxiliary 'avere'; past participle usually does not agree with subject; agreement possible with preceding direct object clitic,Hanno saputo la verità.,They have learned the truth.
trovare,true,trovare,verb,to find,"finding,location",n/a,n/a,n/a,n/a,non-finite,infinitive,false,false,false,n/a,n/a,n/a,n/a,base lemma,Voglio trovare le chiavi.,I want to find the keys.
trovando,false,trovare,verb,finding,"finding,location",n/a,n/a,n/a,n/a,non-finite,gerund,false,false,false,n/a,n/a,n/a,n/a,n/a,Sto trovando una soluzione.,I am finding a solution.
trovato,false,trovare,verb,found (masculine singular),"finding,location",n/a,n/a,masculine,singular,non-finite,participle,false,false,false,n/a,n/a,n/a,n/a,used with auxiliary 'avere' to form compound tenses,Il libro è stato trovato.,The book was found.
trovata,false,trovare,verb,found (feminine singular),"finding,location",n/a,n/a,feminine,singular,non-finite,participle,false,false,false,n/a,n/a,n/a,n/a,used with auxiliary 'avere' to form compound tenses,La lettera è stata trovata.,The letter was found.
trovati,false,trovare,verb,found (masculine plural),"finding,location",n/a,n/a,masculine,plural,non-finite,participle,false,false,false,n/a,n/a,n/a,n/a,used with auxiliary 'avere' to form compound tenses,I documenti sono stati trovati.,The documents were found.
trovate,false,trovare,verb,found (feminine plural),"finding,location",n/a,n/a,feminine,plural,non-finite,participle,false,false,false,n/a,n/a,n/a,n/a,used with auxiliary 'avere' to form compound tenses,Le chiavi sono state trovate.,The keys were found.
trovo,false,trovare,verb,I find / I am finding,"finding,location",n/a,1s,n/a,singular,indicative,present,false,false,false,n/a,n/a,n/a,n/a,n/a,Io trovo sempre ciò che cerco.,I always find what I look for.
trovi,false,trovare,verb,you find / you are finding,"finding,location",n/a,2s,n/a,singular,indicative,present,false,false,false,n/a,n/a,n/a,n/a,n/a,Tu trovi spesso buone offerte.,You often find good deals.
trova,false,trovare,verb,he/she/it finds,"finding,location",n/a,3s,n/a,singular,indicative,present,false,false,false,n/a,n/a,n/a,n/a,also 'you (formal)',Lui trova il tempo per leggere.,He finds time to read.
troviamo,false,trovare,verb,we find,"finding,location",n/a,1p,n/a,plural,indicative,present,false,false,false,n/a,n/a,n/a,n/a,n/a,Noi troviamo la soluzione insieme.,We find the solution together.
trovate,false,trovare,verb,you (plural) find,"finding,location",n/a,2p,n/a,plural,indicative,present,false,false,false,n/a,n/a,n/a,n/a,n/a,Voi trovate gli errori facilmente.,You (plural) find mistakes easily.
trovano,false,trovare,verb,they find,"finding,location",n/a,3p,n/a,plural,indicative,present,false,false,false,n/a,n/a,n/a,n/a,n/a,Loro trovano la casa ideale.,They find the ideal house.
trovavo,false,trovare,verb,I was finding / I found (imperfect),"finding,location",n/a,1s,n/a,singular,indicative,imperfect,false,false,false,n/a,n/a,n/a,n/a,n/a,Io trovavo spesso cose interessanti.,I often found interesting things.
trovavi,false,trovare,verb,you were finding,"finding,location",n/a,2s,n/a,singular,indicative,imperfect,false,false,false,n/a,n/a,n/a,n/a,n/a,Tu trovavi sempre una scusa.,You always found an excuse.
trovava,false,trovare,verb,he/she/it was finding,"finding,location",n/a,3s,n/a,singular,indicative,imperfect,false,false,false,n/a,n/a,n/a,n/a,also 'you were (formal)',Lui trovava difficile concentrarsi.,He found it difficult to concentrate.
trovavamo,false,trovare,verb,we were finding,"finding,location",n/a,1p,n/a,plural,indicative,imperfect,false,false,false,n/a,n/a,n/a,n/a,n/a,Noi trovavamo piacere in piccoli gesti.,We found pleasure in small gestures.
