term_italian,is_base,base_lemma_italian,part_of_speech,translation_english,topics,subtype,person_number,gender,plurality,mood,tense,is_comparative,is_superlative,is_compound,article_type,article_italian,added_particle_italian,preposition,notes,example_sentence_italian,example_sentence_english
nell'autobus,false,autobus,noun,in the bus,"transport,public",n/a,n/a,masculine,singular,n/a,n/a,false,false,false,articulated_preposition,l',nell',in,n/a,Posti liberi nell'autobus.,Free seats on the bus.
negli autobus,false,autobus,noun,in the buses,"transport,public",n/a,n/a,masculine,plural,n/a,n/a,false,false,false,articulated_preposition,gli,negli,in,invariable plural,Aria condizionata negli autobus.,Air conditioning on the buses.
sull'autobus,false,autobus,noun,on the bus,"transport,public",n/a,n/a,masculine,singular,n/a,n/a,false,false,false,articulated_preposition,l',sull',su,n/a,Oblitero il biglietto sull'autobus.,I validate the ticket on the bus.
sugli autobus,false,autobus,noun,on the buses,"transport,public",n/a,n/a,masculine,plural,n/a,n/a,false,false,false,articulated_preposition,gli,sugli,su,invariable plural,Cartelli sugli autobus.,Signs on the buses.
con l'autobus,false,autobus,noun,with the bus,"transport,public",n/a,n/a,masculine,singular,n/a,n/a,false,false,false,articulated_preposition,l',con l',con,n/a,Vado con l'autobus.,I go by bus.
con gli autobus,false,autobus,noun,with the buses,"transport,public",n/a,n/a,masculine,plural,n/a,n/a,false,false,false,articulated_preposition,gli,con gli,con,n/a,Viaggio con gli autobus notturni.,I travel with the night buses.
bagno,true,bagno,noun,bathroom,"home,facilities",n/a,n/a,masculine,singular,n/a,n/a,false,false,false,none,n/a,n/a,n/a,base lemma,Cerco bagno pulito.,I'm looking for a clean bathroom.
un bagno,false,bagno,noun,a bathroom,"home,facilities",n/a,n/a,masculine,singular,n/a,n/a,false,false,false,indefinite,un,un,n/a,n/a,Abbiamo un bagno grande.,We have a large bathroom.
il bagno,false,bagno,noun,the bathroom,"home,facilities",n/a,n/a,masculine,singular,n/a,n/a,false,false,false,definite,il,il,n/a,n/a,Il bagno è occupato.,The bathroom is occupied.
bagni,false,bagno,noun,bathrooms,"home,facilities",n/a,n/a,masculine,plural,n/a,n/a,false,false,false,none,n/a,n/a,n/a,plural form,Bagni puliti al piano.,Clean bathrooms on the floor.
i bagni,false,bagno,noun,the bathrooms,"home,facilities",n/a,n/a,masculine,plural,n/a,n/a,false,false,false,definite,i,i,n/a,n/a,I bagni sono chiusi.,The bathrooms are closed.
dei bagni,false,bagno,noun,some bathrooms,"home,facilities",n/a,n/a,masculine,plural,n/a,n/a,false,false,false,articulated_preposition,i,dei,di,n/a,Ristrutturiamo dei bagni.,We're renovating some bathrooms.
del bagno,false,bagno,noun,of the bathroom,"home,facilities",n/a,n/a,masculine,singular,n/a,n/a,false,false,false,articulated_preposition,il,del,di,n/a,La porta del bagno scricchiola.,The bathroom door squeaks.
al bagno,false,bagno,noun,to the bathroom,"home,facilities",n/a,n/a,masculine,singular,n/a,n/a,false,false,false,articulated_preposition,il,al,a,n/a,Vado al bagno.,I'm going to the bathroom.
ai bagni,false,bagno,noun,to the bathrooms,"home,facilities",n/a,n/a,masculine,plural,n/a,n/a,false,false,false,articulated_preposition,i,ai,a,n/a,Accesso ai bagni a sinistra.,Access to the bathrooms on the left.
dal bagno,false,bagno,noun,from the bathroom,"home,facilities",n/a,n/a,masculine,singular,n/a,n/a,false,false,false,articulated_preposition,il,dal,da,n/a,Esco dal bagno.,I exit the bathroom.
dai bagni,false,bagno,noun,from the bathrooms,"home,facilities",n/a,n/a,masculine,plural,n/a,n/a,false,false,false,articulated_preposition,i,dai,da,n/a,Rumori dai bagni.,Noises from the bathrooms.
nel bagno,false,bagno,noun,in the bathroom,"home,facilities",n/a,n/a,masculine,singular,n/a,n/a,false,false,false,articulated_preposition,il,nel,in,n/a,C'è sapone nel bagno.,There is soap in the bathroom.
nei bagni,false,bagno,noun,in the bathrooms,"home,facilities",n/a,n/a,masculine,plural,n/a,n/a,false,false,false,articulated_preposition,i,nei,in,n/a,Cartelli nei bagni.,Signs in the bathrooms.
sul bagno,false,bagno,noun,on the bathroom,"home,facilities",n/a,n/a,masculine,singular,n/a,n/a,false,false,false,articulated_preposition,il,sul,su,n/a,Lavori sul bagno oggi.,Work on the bathroom today.
sui bagni,false,bagno,noun,on the bathrooms,"home,facilities",n/a,n/a,masculine,plural,n/a,n/a,false,false,false,articulated_preposition,i,sui,su,n/a,Interventi sui bagni pubblici.,Work on public bathrooms.
col bagno,false,bagno,noun,with the bathroom,"home,facilities",n/a,n/a,masculine,singular,n/a,n/a,false,false,false,articulated_preposition,il,col,con,contraction of con + il,Problemi col bagno di servizio.,Problems with the service bathroom.
coi bagni,false,bagno,noun,with the bathrooms,"home,facilities",n/a,n/a,masculine,plural,n/a,n/a,false,false,false,articulated_preposition,i,coi,con,contraction of con + i,Lavoro coi bagni del piano.,I work with the bathrooms on the floor.
bar,true,bar,noun,bar,"travel,cafe",n/a,n/a,masculine,singular,n/a,n/a,false,false,false,none,n/a,n/a,n/a,base lemma,Vedo un bar vicino.,I see a nearby bar.
un bar,false,bar,noun,a bar,"travel,cafe",n/a,n/a,masculine,singular,n/a,n/a,false,false,false,indefinite,un,un,n/a,n/a,Entriamo in un bar.,We're going into a bar.
il bar,false,bar,noun,the bar,"travel,cafe",n/a,n/a,masculine,singular,n/a,n/a,false,false,false,definite,il,il,n/a,n/a,Il bar apre presto.,The bar opens early.
bar,false,bar,noun,bars,"travel,cafe",n/a,n/a,masculine,plural,n/a,n/a,false,false,false,none,n/a,n/a,n/a,invariable plural,Bar affollati stasera.,Bars are crowded tonight.
i bar,false,bar,noun,the bars,"travel,cafe",n/a,n/a,masculine,plural,n/a,n/a,false,false,false,definite,i,i,n/a,invariable plural,I bar sono pieni.,The bars are full.
dei bar,false,bar,noun,some bars,"travel,cafe",n/a,n/a,masculine,plural,n/a,n/a,false,false,false,articulated_preposition,i,dei,di,invariable plural,Visito dei bar nuovi.,I visit some new bars.
del bar,false,bar,noun,of the bar,"travel,cafe",n/a,n/a,masculine,singular,n/a,n/a,false,false,false,articulated_preposition,il,del,di,n/a,Il bancone del bar è lungo.,The bar's counter is long.
al bar,false,bar,noun,to the bar,"travel,cafe",n/a,n/a,masculine,singular,n/a,n/a,false,false,false,articulated_preposition,il,al,a,n/a,Andiamo al bar.,We're going to the bar.
ai bar,false,bar,noun,to the bars,"travel,cafe",n/a,n/a,masculine,plural,n/a,n/a,false,false,false,articulated_preposition,i,ai,a,invariable plural,Lavoro ai bar del porto.,I work at the harbor's bars.
dal bar,false,bar,noun,from the bar,"travel,cafe",n/a,n/a,masculine,singular,n/a,n/a,false,false,false,articulated_preposition,il,dal,da,n/a,Esco dal bar.,I leave the bar.
dai bar,false,bar,noun,from the bars,"travel,cafe",n/a,n/a,masculine,plural,n/a,n/a,false,false,false,articulated_preposition,i,dai,da,invariable plural,Rumori dai bar vicini.,Noises from nearby bars.
nel bar,false,bar,noun,in the bar,"travel,cafe",n/a,n/a,masculine,singular,n/a,n/a,false,false,false,articulated_preposition,il,nel,in,n/a,Lavoro nel bar.,I work in the bar.
nei bar,false,bar,noun,in the bars,"travel,cafe",n/a,n/a,masculine,plural,n/a,n/a,false,false,false,articulated_preposition,i,nei,in,invariable plural,Musica nei bar del centro.,Music in downtown bars.
sul bar,false,bar,noun,on the bar,"travel,cafe",n/a,n/a,masculine,singular,n/a,n/a,false,false,false,articulated_preposition,il,sul,su,n/a,Metto il giornale sul bar.,I put the newspaper on the bar.
sui bar,false,bar,noun,on the bars,"travel,cafe",n/a,n/a,masculine,plural,n/a,n/a,false,false,false,articulated_preposition,i,sui,su,invariable plural,Regole sui bar notturni.,Rules about night bars.
col bar,false,bar,noun,with the bar,"travel,cafe",n/a,n/a,masculine,singular,n/a,n/a,false,false,false,articulated_preposition,il,col,con,contraction of con + il,Parlo col bar di quartiere.,I talk with the neighborhood bar.
coi bar,false,bar,noun,with the bars,"travel,cafe",n/a,n/a,masculine,plural,n/a,n/a,false,false,false,articulated_preposition,i,coi,con,contraction of con + i,Lavoriamo coi bar locali.,We work with local bars.
biglietto,true,biglietto,noun,ticket,"travel,transport",n/a,n/a,masculine,singular,n/a,n/a,false,false,false,none,n/a,n/a,n/a,base lemma,Compro un biglietto online.,I buy a ticket online.
un biglietto,false,biglietto,noun,a ticket,"travel,transport",n/a,n/a,masculine,singular,n/a,n/a,false,false,false,indefinite,un,un,n/a,n/a,Mi serve un biglietto.,I need a ticket.
il biglietto,false,biglietto,noun,the ticket,"travel,transport",n/a,n/a,masculine,singular,n/a,n/a,false,false,false,definite,il,il,n/a,n/a,Il biglietto costa poco.,The ticket is cheap.
biglietti,false,biglietto,noun,tickets,"travel,transport",n/a,n/a,masculine,plural,n/a,n/a,false,false,false,none,n/a,n/a,n/a,plural form,Biglietti esauriti.,Tickets sold out.
i biglietti,false,biglietto,noun,the tickets,"travel,transport",n/a,n/a,masculine,plural,n/a,n/a,false,false,false,definite,i,i,n/a,n/a,I biglietti sono validi.,The tickets are valid.
dei biglietti,false,biglietto,noun,some tickets,"travel,transport",n/a,n/a,masculine,plural,n/a,n/a,false,false,false,articulated_preposition,i,dei,di,n/a,Compra dei biglietti extra.,Buy some extra tickets.
del biglietto,false,biglietto,noun,of the ticket,"travel,transport",n/a,n/a,masculine,singular,n/a,n/a,false,false,false,articulated_preposition,il,del,di,n/a,La data del biglietto è sbagliata.,The ticket's date is wrong.
al biglietto,false,biglietto,noun,to the ticket,"travel,transport",n/a,n/a,masculine,singular,n/a,n/a,false,false,false,articulated_preposition,il,al,a,n/a,Aggiungo il nome al biglietto.,I add the name to the ticket.
ai biglietti,false,biglietto,noun,to the tickets,"travel,transport",n/a,n/a,masculine,plural,n/a,n/a,false,false,false,articulated_preposition,i,ai,a,n/a,Accedo ai biglietti digitali.,I access the digital tickets.
dal biglietto,false,biglietto,noun,from the ticket,"travel,transport",n/a,n/a,masculine,singular,n/a,n/a,false,false,false,articulated_preposition,il,dal,da,n/a,Leggo i dati dal biglietto.,I read the data from the ticket.
dai biglietti,false,biglietto,noun,from the tickets,"travel,transport",n/a,n/a,masculine,plural,n/a,n/a,false,false,false,articulated_preposition,i,dai,da,n/a,Codici dai biglietti cartacei.,Codes from the paper tickets.
nel biglietto,false,biglietto,noun,in the ticket,"travel,transport",n/a,n/a,masculine,singular,n/a,n/a,false,false,false,articulated_preposition,il,nel,in,n/a,C'è un errore nel biglietto.,There's an error in the ticket.
nei biglietti,false,biglietto,noun,in the tickets,"travel,transport",n/a,n/a,masculine,plural,n/a,n/a,false,false,false,articulated_preposition,i,nei,in,n/a,Note nei biglietti.,Notes in the tickets.
sul biglietto,false,biglietto,noun,on the ticket,"travel,transport",n/a,n/a,masculine,singular,n/a,n/a,false,false,false,articulated_preposition,il,sul,su,n/a,Firma sul biglietto.,Signature on the ticket.
sui biglietti,false,biglietto,noun,on the tickets,"travel,transport",n/a,n/a,masculine,plural,n/a,n/a,false,false,false,articulated_preposition,i,sui,su,n/a,Sconti sui biglietti.,Discounts on the tickets.
col biglietto,false,biglietto,noun,with the ticket,"travel,transport",n/a,n/a,masculine,singular,n/a,n/a,false,false,false,articulated_preposition,il,col,con,contraction of con + il,Entro col biglietto elettronico.,I enter with the electronic ticket.
coi biglietti,false,biglietto,noun,with the tickets,"travel,transport",n/a,n/a,masculine,plural,n/a,n/a,false,false,false,articulated_preposition,i,coi,con,contraction of con + i,Viaggio coi biglietti prepagati.,I travel with prepaid tickets.
caffè,true,caffè,noun,coffee,"beverages,cafe",n/a,n/a,masculine,singular,n/a,n/a,false,false,false,none,n/a,n/a,n/a,base lemma,Vedo un caffè aperto.,I see an open café.
un caffè,false,caffè,noun,a coffee,"beverages,cafe",n/a,n/a,masculine,singular,n/a,n/a,false,false,false,indefinite,un,un,n/a,n/a,Prendo un caffè al banco.,I'll have a coffee at the counter.
il caffè,false,caffè,noun,the coffee,"beverages,cafe",n/a,n/a,masculine,singular,n/a,n/a,false,false,false,definite,il,il,n/a,n/a,Il caffè è caldo.,The coffee is hot.
caffè,false,caffè,noun,coffees,"beverages,cafe",n/a,n/a,masculine,plural,n/a,n/a,false,false,false,none,n/a,n/a,n/a,invariable plural,Caffè italiani sono famosi.,Italian coffees are famous.
i caffè,false,caffè,noun,the coffees,"beverages,cafe",n/a,n/a,masculine,plural,n/a,n/a,false,false,false,definite,i,i,n/a,invariable plural,I caffè del centro sono pieni.,The cafés downtown are full.
dei caffè,false,caffè,noun,some coffees,"beverages,cafe",n/a,n/a,masculine,plural,n/a,n/a,false,false,false,articulated_preposition,i,dei,di,invariable plural,Abbiamo preso dei caffè.,We had some coffees.
del caffè,false,caffè,noun,of the coffee,"beverages,cafe",n/a,n/a,masculine,singular,n/a,n/a,false,false,false,articulated_preposition,il,del,di,n/a,Bevo del caffè al mattino.,I drink some coffee in the morning.
al caffè,false,caffè,noun,to the coffee,"beverages,cafe",n/a,n/a,masculine,singular,n/a,n/a,false,false,false,articulated_preposition,il,al,a,n/a,Aggiungo zucchero al caffè.,I add sugar to the coffee.
ai caffè,false,caffè,noun,to the coffees,"beverages,cafe",n/a,n/a,masculine,plural,n/a,n/a,false,false,false,articulated_preposition,i,ai,a,invariable plural,Porto biscotti ai caffè.,I bring cookies to the coffees/cafés.
dal caffè,false,caffè,noun,from the coffee,"beverages,cafe",n/a,n/a,masculine,singular,n/a,n/a,false,false,false,articulated_preposition,il,dal,da,n/a,Sento profumo dal caffè.,I smell aroma from the coffee.
dai caffè,false,caffè,noun,from the coffees,"beverages,cafe",n/a,n/a,masculine,plural,n/a,n/a,false,false,false,articulated_preposition,i,dai,da,invariable plural,Musica arriva dai caffè.,Music comes from the cafés.
nel caffè,false,caffè,noun,in the coffee,"beverages,cafe",n/a,n/a,masculine,singular,n/a,n/a,false,false,false,articulated_preposition,il,nel,in,n/a,Metto latte nel caffè.,I put milk in the coffee.
nei caffè,false,caffè,noun,in the coffees,"beverages,cafe",n/a,n/a,masculine,plural,n/a,n/a,false,false,false,articulated_preposition,i,nei,in,invariable plural,Si fuma meno nei caffè.,People smoke less in cafés.
sul caffè,false,caffè,noun,on the coffee,"beverages,cafe",n/a,n/a,masculine,singular,n/a,n/a,false,false,false,articulated_preposition,il,sul,su,n/a,Ho letto un articolo sul caffè.,I read an article about coffee.
sui caffè,false,caffè,noun,on the coffees,"beverages,cafe",n/a,n/a,masculine,plural,n/a,n/a,false,false,false,articulated_preposition,i,sui,su,invariable plural,Parliamo spesso sui caffè.,We often talk about cafés.
col caffè,false,caffè,noun,with the coffee,"beverages,cafe",n/a,n/a,masculine,singular,n/a,n/a,false,false,false,articulated_preposition,il,col,con,contraction of con + il,Lo bevo col caffè.,I drink it with the coffee.
coi caffè,false,caffè,noun,with the coffees,"beverages,cafe",n/a,n/a,masculine,plural,n/a,n/a,false,false,false,articulated_preposition,i,coi,con,contraction of con + i,Arrivano i conti coi caffè.,The bills arrive with the coffees.
camera,true,camera,noun,room,"home,travel",n/a,n/a,feminine,singular,n/a,n/a,false,false,false,none,n/a,n/a,n/a,base lemma,Prenoto camera doppia.,I book a double room.
una camera,false,camera,noun,a room,"home,travel",n/a,n/a,feminine,singular,n/a,n/a,false,false,false,indefinite,una,una,n/a,n/a,Cerco una camera silenziosa.,I'm looking for a quiet room.
la camera,false,camera,noun,the room,"home,travel",n/a,n/a,feminine,singular,n/a,n/a,false,false,false,definite,la,la,n/a,n/a,La camera è luminosa.,The room is bright.
camere,false,camera,noun,rooms,"home,travel",n/a,n/a,feminine,plural,n/a,n/a,false,false,false,none,n/a,n/a,n/a,plural form,Camere libere stanotte.,Rooms available tonight.
le camere,false,camera,noun,the rooms,"home,travel",n/a,n/a,feminine,plural,n/a,n/a,false,false,false,definite,le,le,n/a,n/a,Le camere sono pulite.,The rooms are clean.
delle camere,false,camera,noun,some rooms,"home,travel",n/a,n/a,feminine,plural,n/a,n/a,false,false,false,articulated_preposition,le,delle,di,n/a,Abbiamo delle camere libere.,We have some available rooms.
della camera,false,camera,noun,of the room,"home,travel",n/a,n/a,feminine,singular,n/a,n/a,false,false,false,articulated_preposition,la,della,di,n/a,La chiave della camera è qui.,The room's key is here.
alla camera,false,camera,noun,to the room,"home,travel",n/a,n/a,feminine,singular,n/a,n/a,false,false,false,articulated_preposition,la,alla,a,n/a,Vado alla camera ora.,I'm going to the room now.
alle camere,false,camera,noun,to the rooms,"home,travel",n/a,n/a,feminine,plural,n/a,n/a,false,false,false,articulated_preposition,le,alle,a,n/a,Accesso alle camere al primo piano.,Access to the rooms on the first floor.
dalla camera,false,camera,noun,from the room,"home,travel",n/a,n/a,feminine,singular,n/a,n/a,false,false,false,articulated_preposition,la,dalla,da,n/a,Esco dalla camera.,I leave the room.
dalle camere,false,camera,noun,from the rooms,"home,travel",n/a,n/a,feminine,plural,n/a,n/a,false,false,false,articulated_preposition,le,dalle,da,n/a,Rumori dalle camere vicine.,Noises from the nearby rooms.
nella camera,false,camera,noun,in the room,"home,travel",n/a,n/a,feminine,singular,n/a,n/a,false,false,false,articulated_preposition,la,nella,in,n/a,C'è luce nella camera.,There is light in the room.
nelle camere,false,camera,noun,in the rooms,"home,travel",n/a,n/a,feminine,plural,n/a,n/a,false,false,false,articulated_preposition,le,nelle,in,n/a,Ventilatori nelle camere.,Fans in the rooms.
sulla camera,false,camera,noun,on the room,"home,travel",n/a,n/a,feminine,singular,n/a,n/a,false,false,false,articulated_preposition,la,sulla,su,n/a,Nota sulla camera 12.,A note about room 12.
sulle camere,false,camera,noun,on the rooms,"home,travel",n/a,n/a,feminine,plural,n/a,n/a,false,false,false,articulated_preposition,le,sulle,su,n/a,Commenti sulle camere.,Comments on the rooms.
con la camera,false,camera,noun,with the room,"home,travel",n/a,n/a,feminine,singular,n/a,n/a,false,false,false,articulated_preposition,la,con la,con,n/a,Pago con la camera inclusa.,I pay with the room included.
con le camere,false,camera,noun,with the rooms,"home,travel",n/a,n/a,feminine,plural,n/a,n/a,false,false,false,articulated_preposition,le,con le,con,n/a,Lavoro con le camere deluxe.,I work with the deluxe rooms.
macchina,true,macchina,noun,car,"transport,everyday",n/a,n/a,feminine,singular,n/a,n/a,false,false,false,none,n/a,n/a,n/a,base lemma,Guido macchina nuova.,I drive a new car.
una macchina,false,macchina,noun,a car,"transport,everyday",n/a,n/a,feminine,singular,n/a,n/a,false,false,false,indefinite,una,una,n/a,n/a,Noleggio una macchina.,I rent a car.
la macchina,false,macchina,noun,the car,"transport,everyday",n/a,n/a,feminine,singular,n/a,n/a,false,false,false,definite,la,la,n/a,n/a,La macchina è veloce.,The car is fast.
macchine,false,macchina,noun,cars,"transport,everyday",n/a,n/a,feminine,plural,n/a,n/a,false,false,false,none,n/a,n/a,n/a,plural form,Macchine elettriche in città.,Electric cars in the city.
le macchine,false,macchina,noun,the cars,"transport,everyday",n/a,n/a,feminine,plural,n/a,n/a,false,false,false,definite,le,le,n/a,n/a,Le macchine sono parcheggiate.,The cars are parked.
delle macchine,false,macchina,noun,some cars,"transport,everyday",n/a,n/a,feminine,plural,n/a,n/a,false,false,false,articulated_preposition,le,delle,di,n/a,Compriamo delle macchine usate.,We're buying some used cars.
della macchina,false,macchina,noun,of the car,"transport,everyday",n/a,n/a,feminine,singular,n/a,n/a,false,false,false,articulated_preposition,la,della,di,n/a,Il colore della macchina mi piace.,I like the car's color.
alla macchina,false,macchina,noun,to the car,"transport,everyday",n/a,n/a,feminine,singular,n/a,n/a,false,false,false,articulated_preposition,la,alla,a,n/a,Vado alla macchina.,I'm going to the car.
alle macchine,false,macchina,noun,to the cars,"transport,everyday",n/a,n/a,feminine,plural,n/a,n/a,false,false,false,articulated_preposition,le,alle,a,n/a,Accesso alle macchine aziendali.,Access to company cars.
dalla macchina,false,macchina,noun,from the car,"transport,everyday",n/a,n/a,feminine,singular,n/a,n/a,false,false,false,articulated_preposition,la,dalla,da,n/a,Scendo dalla macchina.,I get out of the car.
dalle macchine,false,macchina,noun,from the cars,"transport,everyday",n/a,n/a,feminine,plural,n/a,n/a,false,false,false,articulated_preposition,le,dalle,da,n/a,Rumori dalle macchine.,Noises from the cars.
nella macchina,false,macchina,noun,in the car,"transport,everyday",n/a,n/a,feminine,singular,n/a,n/a,false,false,false,articulated_preposition,la,nella,in,n/a,C'è un cavo nella macchina.,There's a cable in the car.
nelle macchine,false,macchina,noun,in the cars,"transport,everyday",n/a,n/a,feminine,plural,n/a,n/a,false,false,false,articulated_preposition,le,nelle,in,n/a,Bambini nelle macchine.,Children in the cars.
sulla macchina,false,macchina,noun,on the car,"transport,everyday",n/a,n/a,feminine,singular,n/a,n/a,false,false,false,articulated_preposition,la,sulla,su,n/a,Piove sulla macchina.,It's raining on the car.
sulle macchine,false,macchina,noun,on the cars,"transport,everyday",n/a,n/a,feminine,plural,n/a,n/a,false,false,false,articulated_preposition,le,sulle,su,n/a,Polvere sulle macchine.,Dust on the cars.
con la macchina,false,macchina,noun,with the car,"transport,everyday",n/a,n/a,feminine,singular,n/a,n/a,false,false,false,articulated_preposition,la,con la,con,n/a,Vado con la macchina.,I go by car.
con le macchine,false,macchina,noun,with the cars,"transport,everyday",n/a,n/a,feminine,plural,n/a,n/a,false,false,false,articulated_preposition,le,con le,con,n/a,Lavoro con le macchine nuove.,I work with the new cars.
negozio,true,negozio,noun,shop,"shopping,places",n/a,n/a,masculine,singular,n/a,n/a,false,false,false,none,n/a,n/a,n/a,base lemma,Apro negozio nuovo.,I'm opening a new shop.
un negozio,false,negozio,noun,a shop,"shopping,places",n/a,n/a,masculine,singular,n/a,n/a,false,false,false,indefinite,un,un,n/a,n/a,Cerco un negozio economico.,I'm looking for an inexpensive shop.
il negozio,false,negozio,noun,the shop,"shopping,places",n/a,n/a,masculine,singular,n/a,n/a,false,false,false,definite,il,il,n/a,n/a,Il negozio apre alle nove.,The shop opens at nine.
negozi,false,negozio,noun,shops,"shopping,places",n/a,n/a,masculine,plural,n/a,n/a,false,false,false,none,n/a,n/a,n/a,plural form,Negozi piccoli qui.,Small shops here.
i negozi,false,negozio,noun,the shops,"shopping,places",n/a,n/a,masculine,plural,n/a,n/a,false,false,false,definite,i,i,n/a,n/a,I negozi sono chiusi.,The shops are closed.
dei negozi,false,negozio,noun,some shops,"shopping,places",n/a,n/a,masculine,plural,n/a,n/a,false,false,false,articulated_preposition,i,dei,di,n/a,Visito dei negozi locali.,I visit some local shops.
del negozio,false,negozio,noun,of the shop,"shopping,places",n/a,n/a,masculine,singular,n/a,n/a,false,false,false,articulated_preposition,il,del,di,n/a,Il nome del negozio è noto.,The shop's name is well-known.
al negozio,false,negozio,noun,to the shop,"shopping,places",n/a,n/a,masculine,singular,n/a,n/a,false,false,false,articulated_preposition,il,al,a,n/a,Vado al negozio ora.,I'm going to the shop now.
ai negozi,false,negozio,noun,to the shops,"shopping,places",n/a,n/a,masculine,plural,n/a,n/a,false,false,false,articulated_preposition,i,ai,a,n/a,Sconti ai negozi affiliati.,Discounts at affiliated shops.
dal negozio,false,negozio,noun,from the shop,"shopping,places",n/a,n/a,masculine,singular,n/a,n/a,false,false,false,articulated_preposition,il,dal,da,n/a,Torno dal negozio.,I return from the shop.
dai negozi,false,negozio,noun,from the shops,"shopping,places",n/a,n/a,masculine,plural,n/a,n/a,false,false,false,articulated_preposition,i,dai,da,n/a,Merci dai negozi vicini.,Goods from nearby shops.
nel negozio,false,negozio,noun,in the shop,"shopping,places",n/a,n/a,masculine,singular,n/a,n/a,false,false,false,articulated_preposition,il,nel,in,n/a,Lavoro nel negozio.,I work in the shop.
nei negozi,false,negozio,noun,in the shops,"shopping,places",n/a,n/a,masculine,plural,n/a,n/a,false,false,false,articulated_preposition,i,nei,in,n/a,Prezzi nei negozi centrali.,Prices in downtown shops.
sul negozio,false,negozio,noun,on the shop,"shopping,places",n/a,n/a,masculine,singular,n/a,n/a,false,false,false,articulated_preposition,il,sul,su,n/a,Cartello sul negozio.,A sign on the shop.
sui negozi,false,negozio,noun,on the shops,"shopping,places",n/a,n/a,masculine,plural,n/a,n/a,false,false,false,articulated_preposition,i,sui,su,n/a,Regole sui negozi.,Rules about shops.
col negozio,false,negozio,noun,with the shop,"shopping,places",n/a,n/a,masculine,singular,n/a,n/a,false,false,false,articulated_preposition,il,col,con,contraction of con + il,Parlo col negozio online.,I speak with the online shop.
coi negozi,false,negozio,noun,with the shops,"shopping,places",n/a,n/a,masculine,plural,n/a,n/a,false,false,false,articulated_preposition,i,coi,con,contraction of con + i,Collaboro coi negozi locali.,I collaborate with local shops.
pane,true,pane,noun,bread,"food,basics",n/a,n/a,masculine,singular,n/a,n/a,false,false,false,none,n/a,n/a,n/a,base lemma,Mangio pane caldo.,I eat warm bread.
un pane,false,pane,noun,a bread,"food,basics",n/a,n/a,masculine,singular,n/a,n/a,false,false,false,indefinite,un,un,n/a,used for a loaf,Compro un pane integrale.,I buy a wholemeal loaf.
il pane,false,pane,noun,the bread,"food,basics",n/a,n/a,masculine,singular,n/a,n/a,false,false,false,definite,il,il,n/a,n/a,Il pane è fresco.,The bread is fresh.
